16048507,https://www.airbnb.com/rooms/16048507,20170304065726,2017-03-05,Opp pond beautiful detached house,"Beautiful views from the window of double room in modern house with luxury kitchen .    10 minutes from large shopping centres in Wimbledon or Kingston .   20 mins from Waterloo .     Buses to lots of places near by Hampton court ,  Richmond park . Tv. Wi fi available in room and jacuzzi bath .   Room available from now.","","Beautiful views from the window of double room in modern house with luxury kitchen .    10 minutes from large shopping centres in Wimbledon or Kingston .   20 mins from Waterloo .     Buses to lots of places near by Hampton court ,  Richmond park . Tv. Wi fi available in room and jacuzzi bath .   Room available from now.",none,"","","","","",Like normal,https://a0.muscache.com/im/pictures/2e2cb889-c49a-47a9-904e-6511244e60cf.jpg?aki_policy=small,https://a0.muscache.com/im/pictures/2e2cb889-c49a-47a9-904e-6511244e60cf.jpg?aki_policy=medium,https://a0.muscache.com/im/pictures/2e2cb889-c49a-47a9-904e-6511244e60cf.jpg?aki_policy=large,https://a0.muscache.com/im/pictures/2e2cb889-c49a-47a9-904e-6511244e60cf.jpg?aki_policy=x_large,96188094,https://www.airbnb.com/users/show/96188094,Linda,2016-09-21,"London, England, United Kingdom","",within an hour,100%,N/A,f,https://a0.muscache.com/im/pictures/8851b506-4576-4a4e-82ea-de81e5c7d772.jpg?aki_policy=profile_small,https://a0.muscache.com/im/pictures/8851b506-4576-4a4e-82ea-de81e5c7d772.jpg?aki_policy=profile_x_medium,,1,1,"['email', 'phone', 'facebook', 'jumio', 'government_id']",t,t,"Coombe house chase, Coombe, Surrey KT34SL, United Kingdom",,Kingston upon Thames,,Coombe,Surrey,KT34SL,London,"Coombe, United Kingdom",GB,United Kingdom,51.40102375942054,-0.2589768278704667,f,House,Private room,2,2.5,1,2,Real Bed,"{""translation missing: en.hosting_amenity_49"",""translation missing: en.hosting_amenity_50""}",,$45.00,,,$150.00,,1,$35.00,4,28,3 months ago,,27,57,87,87,2017-03-05,0,,,,,,,,,,f,,,f,flexible,f,f,1,
14527936,https://www.airbnb.com/rooms/14527936,20170304065726,2017-03-05,Airport Kingston University Richmond London Double,"My place is close to Kingston University, Kingston Hospital, Richmond Park, Kingston Town Center and riverside! Easy travel to Central London & 24 hour bus service right outside that runs everyday, it also directly travels to Putney Bridge in 25 mins, which is zone 2 underground. The train station is a 10 minute walk. Or only two bus trips takes less than 1 hour You’ll love my place, it is cozy, comfortable, clean & in a safe area! It is great for couples, solo adventurers, business travelers.","","My place is close to Kingston University, Kingston Hospital, Richmond Park, Kingston Town Center and riverside! Easy travel to Central London & 24 hour bus service right outside that runs everyday, it also directly travels to Putney Bridge in 25 mins, which is zone 2 underground. The train station is a 10 minute walk. Or only two bus trips takes less than 1 hour You’ll love my place, it is cozy, comfortable, clean & in a safe area! It is great for couples, solo adventurers, business travelers.",none,"","","","","",Guests should do the dishes after using the cutlery or after rinsing it replace them to the dishwasher and  the guests  do not wear shoes in the house. Addition to that please aware we keep away being opening lower windows because the rooms are all located on ground floor in terms of safety and there are cats and squirrels around the area to avoid coming in. Also there is a table and chairs in the kitchen area we do not take food/takeaways to the rooms and all bins goes to bins located in the kitchen area. Thank you for all your co-operation.. Enjoy your stay :),https://a0.muscache.com/im/pictures/44f8f824-e5ec-4599-958b-33a91c122386.jpg?aki_policy=small,https://a0.muscache.com/im/pictures/44f8f824-e5ec-4599-958b-33a91c122386.jpg?aki_policy=medium,https://a0.muscache.com/im/pictures/44f8f824-e5ec-4599-958b-33a91c122386.jpg?aki_policy=large,https://a0.muscache.com/im/pictures/44f8f824-e5ec-4599-958b-33a91c122386.jpg?aki_policy=x_large,89813442,https://www.airbnb.com/users/show/89813442,Layla,2016-08-14,"Kingston upon Thames, England, United Kingdom","Hello ,
My interests includes history and nature !
Five things I can't live without : Water, food, toothbrush, friends and trees!",within an hour,100%,N/A,f,https://a0.muscache.com/im/pictures/e404af94-e9e0-4600-b9aa-fa5e56cd1ed1.jpg?aki_policy=profile_small,https://a0.muscache.com/im/pictures/e404af94-e9e0-4600-b9aa-fa5e56cd1ed1.jpg?aki_policy=profile_x_medium,,1,1,"['email', 'phone', 'reviews']",t,f,"Kingsnympton Park, Kingston upon Thames, England KT2, United Kingdom",,Kingston upon Thames,,Kingston upon Thames,England,KT2,London,"Kingston upon Thames, United Kingdom",GB,United Kingdom,51.42201138950666,-0.27732770808830803,f,Apartment,Private room,2,1.0,1,1,Real Bed,"{Internet,""Wireless Internet"",Kitchen,""Free parking on premises"",""Pets live on this property"",Dog(s),Heating,Washer,""Smoke detector"",""First aid kit"",Essentials,""Hair dryer"",Iron,""translation missing: en.hosting_amenity_49"",""translation missing: en.hosting_amenity_50""}",,$30.00,,,$99.00,$12.00,1,$18.00,2,1125,yesterday,,27,53,83,354,2017-03-05,6,2016-08-24,2017-02-18,97,10,10,10,10,10,9,f,,,t,moderate,f,f,1,0.93
6179409,https://www.airbnb.com/rooms/6179409,20170304065726,2017-03-05,Double bedroom with private bathroom in Kingston,"Our stylish, Edwardian family home, full of character in Kingston upon Thames is over 100 years old. Our nearest station is Norbiton - 7 minute walk away - 25 min journey to Central London. Attractive, spacious double bedroom with your own private bathroom on top floor, all to yourself. Pubs, restaurants, shops, cafés, markets, Hampton Court Palace, Wimbledon Tennis, Twickenham Rugby Stadium, the river Thames and beautiful Richmond Park nearby. Also Kingston Hospital is 2 minutes walk away.","Our house is a home - it is lived in and loved, quirky and unique.  The room, suitable for single person or a couple, is at the top of the house on 2nd floor, giving you space to relax in privacy.  The windows on opposing sides of the room, fill the space with light, both morning and evening.  The room is clean and bright with a double bed, firm orthopaedic mattress and memory foam mattress topper. Ample hanging space, shelves, chest of drawers and bedside table are provided along with hairdryer, toiletries, bath towels, hand towels and facecloths.  A 24in LED TV in the room is tuned for Freeview channels. Free Wifi available, very good reception (mostly). We have a newly installed ensuite bathroom with toilet, handbasin and shower for your private use only. We also have another (shared) shower room which you can use also if you prefer.  If you would prefer to have a bath, we also have a (shared) bathroom - please, just ask us about it.","Our stylish, Edwardian family home, full of character in Kingston upon Thames is over 100 years old. Our nearest station is Norbiton - 7 minute walk away - 25 min journey to Central London. Attractive, spacious double bedroom with your own private bathroom on top floor, all to yourself. Pubs, restaurants, shops, cafés, markets, Hampton Court Palace, Wimbledon Tennis, Twickenham Rugby Stadium, the river Thames and beautiful Richmond Park nearby. Also Kingston Hospital is 2 minutes walk away. Our house is a home - it is lived in and loved, quirky and unique.  The room, suitable for single person or a couple, is at the top of the house on 2nd floor, giving you space to relax in privacy.  The windows on opposing sides of the room, fill the space with light, both morning and evening.  The room is clean and bright with a double bed, firm orthopaedic mattress and memory foam mattress topper. Ample hanging space, shelves, chest of drawers and bedside table are provided along with hairdryer, to",none,"We live on a fairly busy road and are very well situated - for either a 15 minute walk/5 minute bus ride into Kingston town centre, with all the major shops (John Lewis, Bentall Centre) and bustling market (every day) with many excellent food stalls or 7 minute walk to Norbiton Station, where you can catch a train and be in Waterloo in 25 minutes.  Richmond Park, Hampton Court, Ham House, the riverside, the towpath - all are within easy reach.   If you are wanting to catch Wimbledon Tennis, during June/July, it can be reached by train (25 mins) or 2 buses within approx 45 minutes.  For rugby, travel to Twickenham Stadium by train and walking, will take approx 45 minutes.  We have a very good pub, 2 minutes down the Hill where you can enjoy lunch and dinner menus and many different restaurants in Kingston.  We are 2 minutes away from Kingston Hospital.  Hampton Court Flower Show in July is approx 20 minutes away by bus or train.  For rugby fans, Twickenham Stadium is approx 45 minutes a","As we are here working most of the time, we can be flexible about your check-in time - we will communicate with you before your arrival date, to find out how best to accommodate your travel plans and will make every effort to be here to welcome you at your desired arrival time.   We will provide a ""help yourself"" type breakfast downstairs in our kitchen each morning - home made bread or rolls for toast and jam/marmite/peanut butter, fruit and fibre cereal, muesli & granola, tea and coffee.  Please let us know if you are gluten-free, or have food/nut allergies and we will try to accommodate you. We make our own wine at home, so you may find us in the kitchen, sterilising and bottling wine! We have a tortoise in the garden, he has his own house and the run of the garden - you might see him walking on the grass in the sun.  Of course, he hibernates over winter.","We have a steep drive on which it is permissible for guests to park by prior agreement with ourselves. We often have visitors, so we would advise you the best way to park on the drive to avoid blocking any other cars in. Free parking for 1 car, but for longer than 3 days, there will be a small charge - to be discussed. Trains to Waterloo, Wimbledon, Clapham Junction, Vauxhall are very frequent, buses into Kingston, Wimbledon, Twickenham, Teddington, Richmond are also very frequent.  Trains to and from Gatwick and Heathrow - nearest station Clapham Junction (14 min train journey). From Kingston there is a bus which takes you to Heathrow (leave 1 hour max to get there) for the price of a single bus fare - approx. £1.50 with Oyster card or contactless travel! There are night buses which run to and from central London.","We have a lovely garden in which you are very welcome to sit and relax, eat breakfast, drink tea/coffee if you wish. We have a small 2nd fridge where food and drink can be stored. Accommodation is on a room only basis and therefore the kitchen is not for general use except for preparing light refreshments/snacks, tea/coffee and for your breakfast. Your room is on the top floor of the house.  Leading from here,  there is an ensuite bathroom for your private use alone with shower gel, shampoo and other miscellaneous toiletries all provided.  Towels and facecloths provided as well.  We provide tea and coffee facilities for you to make your own drinks on landing just outside your room. We have free guest wifi. Free Parking, however longer term parking (anything beyond 3 days) will require special arrangement at minimal cost (please discuss with us). We have a very steep drive - if you need help getting up the drive, please knock and we can come out and help you.  Please park considerately ","We have our own office at home, so one (or two of us) will be here working most of the time. We are very happy to offer advice about travel and local information if you require.  Just ask if you need help!  We both can speak some French and a little Spanish - enough to get by.","No smoking on the premises please, at the back of the garden is fine  - ashtray provided!  No pets allowed. Please do not invite anyone to our house, unless previously agreed with us. We will provide you with a spare set of keys - if you come in late or go out early, please be mindful that we both work and therefore need our beauty sleep! If you come in late at night/early morning, we will leave some lights on for you to be able to see to your room.  We ask that the last person in, please lock the front door with the chain - all the other doors in the house are locked for the night. We would appreciate it if you close the windows in the room when you go out, so as not to let any rain in. If you have a car, we provide free parking for up to 3 days - there will be a charge for further days - please discuss with us.  It is important that you park considerately so that BOTH your car and our car can get in and out of the drive easily at all times. Sorry, but we do not allow anyone other tha",https://a0.muscache.com/im/pictures/30fed220-856e-4d22-9d88-76030472dbc9.jpg?aki_policy=small,https://a0.muscache.com/im/pictures/30fed220-856e-4d22-9d88-76030472dbc9.jpg?aki_policy=medium,https://a0.muscache.com/im/pictures/30fed220-856e-4d22-9d88-76030472dbc9.jpg?aki_policy=large,https://a0.muscache.com/im/pictures/30fed220-856e-4d22-9d88-76030472dbc9.jpg?aki_policy=x_large,32033043,https://www.airbnb.com/users/show/32033043,Charlie And Lee,2015-04-27,"Royal Borough of Kingston upon Thames, England, United Kingdom","We are Lee and Charlie and are married with 2 children - 27 and 29 years old. We have a small IT consultancy business working with small businesses, troubleshooting computers particularly Apple Macs.  We have a beautiful, Edwardian home in Kingston upon Thames.  I particularly love cooking, we both like films, gardening, music of all kinds and making wines.  Although it is not strictly a hobby for us, our house is a ""work in progress"" and we often have DIY projects on the go.  ",within an hour,100%,N/A,t,https://a0.muscache.com/im/users/32033043/profile_pic/1434631977/original.jpg?aki_policy=profile_small,https://a0.muscache.com/im/users/32033043/profile_pic/1434631977/original.jpg?aki_policy=profile_x_medium,RB of Kingston upon Thames,1,1,"['email', 'phone', 'reviews', 'jumio']",t,t,"Kingston Hill, Kingston upon Thames, Greater London KT2 7PZ, United Kingdom",RB of Kingston upon Thames,Kingston upon Thames,,Kingston upon Thames,Greater London,KT2 7PZ,London,"Kingston upon Thames, United Kingdom",GB,United Kingdom,51.41853710491494,-0.282554482246231,t,House,Private room,2,1.0,1,1,Real Bed,"{TV,Internet,""Wireless Internet"",Kitchen,""Free parking on premises"",Breakfast,Heating,""Smoke detector"",""Carbon monoxide detector"",""First aid kit"",""Fire extinguisher"",Essentials,Shampoo,Hangers,""Hair dryer"",Iron,""translation missing: en.hosting_amenity_49"",""translation missing: en.hosting_amenity_50""}",,$55.00,$350.00,"$1,000.00",$100.00,$15.00,1,$0.00,1,21,today,,23,50,80,355,2017-03-05,24,2015-07-07,2017-01-29,100,10,10,10,10,10,10,f,,,t,moderate,f,f,1,1.18
9020269,https://www.airbnb.com/rooms/9020269,20170304065726,2017-03-05,Spacious Room next to Richmond Park,"100yds from Richmond Park, 10 min walk to Mainline station into central London. Wetroom/shower shared use. Large room with Sofa Bed, armchair and Wifi.","","100yds from Richmond Park, 10 min walk to Mainline station into central London. Wetroom/shower shared use. Large room with Sofa Bed, armchair and Wifi. Great shopping in Kingston, just 10mins walk. New Café culture in pedestrian area... Mountain bike, walk or ride horses around Richmond park. Trains to central London every 15mins. Busses to Richmond, Wimbledon and Hampton court.",none,"Great shopping in Kingston, just 10mins walk. New Café culture in pedestrian area... Mountain bike, walk or ride horses around Richmond park.","","Trains to central London every 15mins. Busses to Richmond, Wimbledon and Hampton court.","","","",https://a0.muscache.com/im/pictures/d71e99cd-284d-400b-91b7-2c4cbbc11cd8.jpg?aki_policy=small,https://a0.muscache.com/im/pictures/d71e99cd-284d-400b-91b7-2c4cbbc11cd8.jpg?aki_policy=medium,https://a0.muscache.com/im/pictures/d71e99cd-284d-400b-91b7-2c4cbbc11cd8.jpg?aki_policy=large,https://a0.muscache.com/im/pictures/d71e99cd-284d-400b-91b7-2c4cbbc11cd8.jpg?aki_policy=x_large,47094767,https://www.airbnb.com/users/show/47094767,Marcus,2015-10-21,"Kingston upon Thames, England, United Kingdom","",N/A,N/A,N/A,f,https://a0.muscache.com/im/pictures/ae984d47-1799-493c-a030-1d32dfe21a73.jpg?aki_policy=profile_small,https://a0.muscache.com/im/pictures/ae984d47-1799-493c-a030-1d32dfe21a73.jpg?aki_policy=profile_x_medium,RB of Kingston upon Thames,1,1,"['email', 'phone', 'reviews']",t,f,"Queens Court, New Road, Kingston upon Thames, KT2 6SQ, United Kingdom",RB of Kingston upon Thames,Kingston upon Thames,,Kingston upon Thames,,KT2 6SQ,London,"Kingston upon Thames, United Kingdom",GB,United Kingdom,51.419453184080616,-0.2863418326081307,t,House,Private room,2,1.0,1,1,Pull-out Sofa,"{""Wireless Internet"",Heating,""Smoke detector"",""First aid kit"",Essentials,""Lock on bedroom door""}",,$30.00,,,,,1,$0.00,1,1125,15 months ago,,0,0,0,0,2017-03-05,1,2015-11-08,2015-11-08,80,8,6,10,10,10,6,f,,,f,flexible,f,f,1,0.06
16868346,https://www.airbnb.com/rooms/16868346,20170304065726,2017-03-04,4 Bedroom Surbiton home,4 double bed family home suitable for local residents having building work done at their permanent home.,"",4 double bed family home suitable for local residents having building work done at their permanent home.,none,"","","","","","",https://a0.muscache.com/im/pictures/53e1c6e6-5359-4b49-8c90-e6eb0d577bad.jpg?aki_policy=small,https://a0.muscache.com/im/pictures/53e1c6e6-5359-4b49-8c90-e6eb0d577bad.jpg?aki_policy=medium,https://a0.muscache.com/im/pictures/53e1c6e6-5359-4b49-8c90-e6eb0d577bad.jpg?aki_policy=large,https://a0.muscache.com/im/pictures/53e1c6e6-5359-4b49-8c90-e6eb0d577bad.jpg?aki_policy=x_large,35215305,https://www.airbnb.com/users/show/35215305,Barry,2015-06-07,"Surbiton, England, United Kingdom","",within a few hours,100%,N/A,f,https://a0.muscache.com/im/users/35215305/profile_pic/1433766322/original.jpg?aki_policy=profile_small,https://a0.muscache.com/im/users/35215305/profile_pic/1433766322/original.jpg?aki_policy=profile_x_medium,RB of Kingston upon Thames,2,2,"['email', 'phone', 'reviews', 'jumio']",t,t,"Surbiton Hill Park, Surbiton, England KT5 8EF, United Kingdom",RB of Kingston upon Thames,Kingston upon Thames,,Surbiton,England,KT5 8EF,London,"Surbiton, United Kingdom",GB,United Kingdom,51.397563427776454,-0.29520085987669553,t,House,Private room,8,3.5,4,4,Real Bed,"{TV,""Wireless Internet"",Kitchen,""Free parking on premises"",""Pets allowed"",Heating,""Family/kid friendly"",Washer,""Smoke detector"",""Carbon monoxide detector"",""First aid kit"",""Safety card"",""Fire extinguisher"",Essentials,Shampoo,Hangers,""Hair dryer"",Iron,""Laptop friendly workspace""}",,$300.00,,,$100.00,$60.00,1,$0.00,4,1125,2 weeks ago,,20,34,64,320,2017-03-04,0,,,,,,,,,,f,,,f,flexible,f,f,2,
6745039,https://www.airbnb.com/rooms/6745039,20170304065726,2017-03-04,"Luxury Double Room + Private Bath,Modern Apartment","Luxury Double Room with your Own Private Bathroom (dedicated) in a brand new, safe, warm, quiet premium occupier owned apartment 80 meters from the River Thames and only a couple of minutes walk to Kingston centre and riverside. The room has a new 42"" Smart TV with SKY, new quality bed, lounge and kitchen.","Brand new room, new carpet, quality new double bed, new TV, wardrobe. The place is warm, provided with all clean quality John Lewis bedding, toiletries, towels and your own private luxury bathroom. The 42inch smart TV has SKY, Netflix, iplayer. Super fast WIFI available. The place is very quiet. The apartment is a nice size so you will have your own space. I will be around occasionally to help with anything that you may require. Breakfast will be available to help yourself (cereal, orange juice, Nespresso espresso, tea etc). Kitchen has a dish washer, fridge and clothes washer/dryer you may use. Have some comfort in the centre of Kingston Upon Thames!","Luxury Double Room with your Own Private Bathroom (dedicated) in a brand new, safe, warm, quiet premium occupier owned apartment 80 meters from the River Thames and only a couple of minutes walk to Kingston centre and riverside. The room has a new 42"" Smart TV with SKY, new quality bed, lounge and kitchen. Brand new room, new carpet, quality new double bed, new TV, wardrobe. The place is warm, provided with all clean quality John Lewis bedding, toiletries, towels and your own private luxury bathroom. The 42inch smart TV has SKY, Netflix, iplayer. Super fast WIFI available. The place is very quiet. The apartment is a nice size so you will have your own space. I will be around occasionally to help with anything that you may require. Breakfast will be available to help yourself (cereal, orange juice, Nespresso espresso, tea etc). Kitchen has a dish washer, fridge and clothes washer/dryer you may use. Have some comfort in the centre of Kingston Upon Thames! You have your own private room, ",none,"Lovely upmarket area - the best part of Kingston Upon Thames, right next to Canbury Gardens, the River Thames, Richmond Park, central Kingston, the University, train station and Hampton Court park and palace. The boat to Richmond / Hampton court is just opposite the flat. There are many bars and restaurants near the apartment. You can't fail to be comfortable here.","If you make a booking request, it comes straight to my phone and I'm around to confirm within moments - any time of day or night. So you will know straight away if your reservation request is confirmed. This is why I don't use instant book. Also I am on hand to answer questions and help you any time. I do have private parking at the flat but I have to pay £5 a day, so if you require parking just let me know and I'll give you a permit. Please pay me cash for this.","Only 5 minute walk to the oyster zone train station servicing Wimbledon, Clapham Junction and London Waterloo (25 mins) . Late night trains run until 1am and buses from central London all night. The centre of Kingston-Upon-Thames is also 5 minutes walk as are the river bars and restaurants. Hampton Court and local river boats are just nearby.","You have your own private room, your own private bathroom and you may use the lounge, kitchen, and whatever else you need. Breakfast will be provided on a help yourself basis (cereal, juice, Nespress coffee, tea etc). I have fast internet, 42inch TV in your bedroom with sky, netflix and iplayer.","I am out a lot, so you have your own space, but I will be around occasionally to give you any tips on local transport, where to go, how to get into London and what to do around this lovely area whether you are working, or spending time away from home.","The flat is in a very respectful block, although it is amazingly sound proofed, all I ask is loud noise must be kept to a minimum after 11pm and before 7am. You can come and go as you please 24 hours and will have a key. Nobody should be brought back without asking other than those staying for security. But just ask me if you want to bring a friend or relative over and it will be fine. Other than that very chilled out, make the place your home and relax! I'm out a lot and you will love the stay here in your own space.",https://a0.muscache.com/im/pictures/fef8561c-259c-410c-8839-e22e01b8ed4a.jpg?aki_policy=small,https://a0.muscache.com/im/pictures/fef8561c-259c-410c-8839-e22e01b8ed4a.jpg?aki_policy=medium,https://a0.muscache.com/im/pictures/fef8561c-259c-410c-8839-e22e01b8ed4a.jpg?aki_policy=large,https://a0.muscache.com/im/pictures/fef8561c-259c-410c-8839-e22e01b8ed4a.jpg?aki_policy=x_large,35316592,https://www.airbnb.com/users/show/35316592,Ben,2015-06-08,"London, United Kingdom","I am a 36 year old professional engineer. I'm easy to get on with, sociable, can help with the local area, transport, suggestions of how to spend time and welcome you to Kingston Upon Thames. ",within a few hours,100%,N/A,t,https://a0.muscache.com/im/users/35316592/profile_pic/1443107543/original.jpg?aki_policy=profile_small,https://a0.muscache.com/im/users/35316592/profile_pic/1443107543/original.jpg?aki_policy=profile_x_medium,,1,1,"['email', 'phone', 'reviews', 'jumio']",t,t,"Lower Kings Rd, Kingston upon Thames, Greater London KT2 5HP, United Kingdom",,Kingston upon Thames,,Kingston upon Thames,Greater London,KT2 5HP,London,"Kingston upon Thames, United Kingdom",GB,United Kingdom,51.41509112447502,-0.30440549645705317,f,Apartment,Private room,3,1.0,1,1,Real Bed,"{TV,""Cable TV"",Internet,""Wireless Internet"",Kitchen,""Free parking on premises"",Breakfast,""Buzzer/wireless intercom"",Heating,""Family/kid friendly"",Washer,Dryer,""Smoke detector"",""Carbon monoxide detector"",""First aid kit"",""Safety card"",""Fire extinguisher"",Essentials,Shampoo,""24-hour check-in"",Hangers,""Hair dryer"",Iron,""Laptop friendly workspace"",""translation missing: en.hosting_amenity_50""}",,$45.00,,,$150.00,,1,$20.00,1,14,1 week ago,,1,1,11,11,2017-03-04,59,2015-06-19,2016-11-06,99,10,10,10,10,10,10,f,,,f,flexible,f,f,1,2.83
