13577025,https://www.airbnb.com/rooms/13577025,20170304065726,2017-03-05,Entire 2 bed/1 sofabed newly refurbished apartment,"My place is close to Ancient Market, Busaba Eathai, Kingston Riverside, Riverside Walk, Market Place, Turks pier ferries to Richmond or Hampton Court, John Lewis, Bentalls Centre, All Saints Church, Train station, Bus station, Odeon. You’ll love my place because of the views, the location, the people, the ambiance, and the outdoors space. My place is good for couples, business travellers, and families (with kids).","Set in a magnificent Tudor building this delightful fully refurbished two bedroom flat (photos of interior to follow) on Thames Street has a stunning kitchen/dining room overlooking the Church where the Seven Saxon Kings of England were crowned. Turn left out of the house and enjoy the medieval market square, which has retained the magic of its historic origins with exciting daily food and craft stalls. Situated in the heart of Kingston's old quarter and heritage protected area you will be able to enjoy Kingston's myriad of historic tourist attractions first-hand and the characters of the area, including the fish seller, whose family has been selling cod and salmon here since the 18th century and the merry-go-round family, whose descendants were the great circus performers born in Fairfield, which turns out to be the reason for its name.   Only a few minutes walk from the River Thames are some of the areas most celebrated restaurants and you can also pick up a riverboat ride to Hampton","My place is close to Ancient Market, Busaba Eathai, Kingston Riverside, Riverside Walk, Market Place, Turks pier ferries to Richmond or Hampton Court, John Lewis, Bentalls Centre, All Saints Church, Train station, Bus station, Odeon. You’ll love my place because of the views, the location, the people, the ambiance, and the outdoors space. My place is good for couples, business travellers, and families (with kids). Set in a magnificent Tudor building this delightful fully refurbished two bedroom flat (photos of interior to follow) on Thames Street has a stunning kitchen/dining room overlooking the Church where the Seven Saxon Kings of England were crowned. Turn left out of the house and enjoy the medieval market square, which has retained the magic of its historic origins with exciting daily food and craft stalls. Situated in the heart of Kingston's old quarter and heritage protected area you will be able to enjoy Kingston's myriad of historic tourist attractions first-hand and the char",none,"This is a very good neighbourhood with very low crime (Kingston has the lowest crime rate of all the Greater London Boroughs) and has won many awards over the years. The famous old market square, the river, the Bentall's centre and John Lewis are all a couple of minutes walk away.",There is a TV but without an aerial but you are welcome to watch DVDs - some provided.,"The central bus and train stations are close to each other and only 6 minutes walk away from the flat. You can also get the wonderful ferry from Turk's Pier, 5 mins walk away, to Hampton Court upriver or downriver to Richmond. There is paid parking about 5 minutes walk away by the river on Thames Side road.",Whole area,Please call Charlie (PHONE NUMBER HIDDEN) or Juliet (PHONE NUMBER HIDDEN),"",https://a0.muscache.com/im/pictures/bf8b66c3-53aa-4e20-bc5a-da65d6faf923.jpg?aki_policy=small,https://a0.muscache.com/im/pictures/bf8b66c3-53aa-4e20-bc5a-da65d6faf923.jpg?aki_policy=medium,https://a0.muscache.com/im/pictures/bf8b66c3-53aa-4e20-bc5a-da65d6faf923.jpg?aki_policy=large,https://a0.muscache.com/im/pictures/bf8b66c3-53aa-4e20-bc5a-da65d6faf923.jpg?aki_policy=x_large,45469611,https://www.airbnb.com/users/show/45469611,Charlie,2015-09-30,"Kingston upon Thames, England, United Kingdom","I like walking (Beaches, cliffs, parks, forests, riversides), reading (Tolstoy, Bill Bryson, Juliet Coombe), traveling (US, Mexico, Jamaica, Canada, Australia, NZ,India, Sri Lanka, Israel, Italy, France, Holland, Spain, Zimbabwe), writing, theatre, movies (countless), ice cream, trifle, chocolate, licorice and so much more...",within a day,100%,N/A,t,https://a0.muscache.com/im/users/45469611/profile_pic/1444039112/original.jpg?aki_policy=profile_small,https://a0.muscache.com/im/users/45469611/profile_pic/1444039112/original.jpg?aki_policy=profile_x_medium,RB of Kingston upon Thames,2,2,"['email', 'phone', 'reviews']",t,f,"Thames Street, Kingston upon Thames, England KT1, United Kingdom",RB of Kingston upon Thames,Kingston upon Thames,,Kingston upon Thames,England,KT1,London,"Kingston upon Thames, United Kingdom",GB,United Kingdom,51.41189345861873,-0.3060834986939726,f,Apartment,Entire home/apt,7,1.0,2,4,Real Bed,"{Internet,""Wireless Internet"",Kitchen,""Hot tub"",""Buzzer/wireless intercom"",Heating,Washer,Essentials,Hangers,""Hair dryer"",Iron,""translation missing: en.hosting_amenity_49"",""translation missing: en.hosting_amenity_50""}",,$150.00,,,$100.00,,6,$30.00,3,42,4 days ago,,3,8,16,87,2017-03-05,2,2016-08-15,2017-01-03,100,10,10,9,10,10,10,f,,,f,strict,f,f,2,0.30
16716104,https://www.airbnb.com/rooms/16716104,20170304065726,2017-03-05,Kingston Double room with terrace,"Our double bedroom with a King Size bed is quiet and comfortable for one or two people.  Our House is located near Kingston Hospital and 5 mins walk from norbiton train station, 15 mins walk from Kingston Train station and next to bus stop. We have 3 parking spot. For more info,  guests and rooms please contact me.","","Our double bedroom with a King Size bed is quiet and comfortable for one or two people.  Our House is located near Kingston Hospital and 5 mins walk from norbiton train station, 15 mins walk from Kingston Train station and next to bus stop. We have 3 parking spot. For more info,  guests and rooms please contact me. Guests are allowed to acces kitchen, living room , garden , terrace and bathrooms.",none,"","","","Guests are allowed to acces kitchen, living room , garden , terrace and bathrooms.","","",https://a0.muscache.com/im/pictures/9bb6e00f-b94f-427a-beed-b475f5443e3e.jpg?aki_policy=small,https://a0.muscache.com/im/pictures/9bb6e00f-b94f-427a-beed-b475f5443e3e.jpg?aki_policy=medium,https://a0.muscache.com/im/pictures/9bb6e00f-b94f-427a-beed-b475f5443e3e.jpg?aki_policy=large,https://a0.muscache.com/im/pictures/9bb6e00f-b94f-427a-beed-b475f5443e3e.jpg?aki_policy=x_large,90757380,https://www.airbnb.com/users/show/90757380,Ali Yasin,2016-08-19,"London, England, United Kingdom","",within a day,100%,N/A,f,https://a0.muscache.com/im/pictures/b6173225-e812-4881-b668-20565dca6ac9.jpg?aki_policy=profile_small,https://a0.muscache.com/im/pictures/b6173225-e812-4881-b668-20565dca6ac9.jpg?aki_policy=profile_x_medium,RB of Kingston upon Thames,1,1,"['email', 'phone', 'facebook', 'reviews']",t,f,"Kingston Hill, Kingston upon Thames, England KT2 7PZ, United Kingdom",RB of Kingston upon Thames,Kingston upon Thames,,Kingston upon Thames,England,KT2 7PZ,London,"Kingston upon Thames, United Kingdom",GB,United Kingdom,51.41761259081109,-0.2815221510625976,t,House,Private room,2,2.0,1,1,Real Bed,"{""Wireless Internet"",Kitchen,""Free parking on premises"",""Smoking allowed"",""Pets allowed"",""Hot tub"",""Family/kid friendly"",Washer,""Smoke detector"",Essentials,Shampoo,""Lock on bedroom door"",Hangers,""Hair dryer"",Iron,""translation missing: en.hosting_amenity_50"",""Private living room""}",,$60.00,,,,,2,$50.00,1,14,3 days ago,,19,49,79,79,2017-03-05,1,2017-01-28,2017-03-02,100,10,10,10,10,10,10,f,,,f,flexible,f,f,1,0.81
7283027,https://www.airbnb.com/rooms/7283027,20170304065726,2017-03-05,LARGE TENT IN LEAFY SUBURBAN GARDEN,"Our 6-person tent in secluded, usually quiet garden is ideal for campers on a budget! Access Central London in just 25 mins from New Malden Station. Enjoy continental breakfast provided on our shady patio or sunny decked area.","This 6-person tent has a separate zip-up sleeping compartment, and a living area large enough to stand up in. It is pitched in our generally quiet, medium-sized back garden between our willow and cherry trees, on the lawn. A good quality double inflatable mattress with your choice of either duvet or sleeping bag, feather or foam pillows, should provide you with a comfortable night's sleep close to nature; there is also a single camping mattress suitable for a third person, available for an extra £10 per night.","Our 6-person tent in secluded, usually quiet garden is ideal for campers on a budget! Access Central London in just 25 mins from New Malden Station. Enjoy continental breakfast provided on our shady patio or sunny decked area. This 6-person tent has a separate zip-up sleeping compartment, and a living area large enough to stand up in. It is pitched in our generally quiet, medium-sized back garden between our willow and cherry trees, on the lawn. A good quality double inflatable mattress with your choice of either duvet or sleeping bag, feather or foam pillows, should provide you with a comfortable night's sleep close to nature; there is also a single camping mattress suitable for a third person, available for an extra £10 per night. The tent is a roomy Zempire Invert 6. We provide a back door key for use of the shared bathroom with both shower and bath. Continental breakfast is included, and can be served on our shady patio or on our sunny decked area. We have a conservatory dining roo",none,"Our neighbours are usually quiet, although they do very occasionally entertain in their gardens.","We have an elderly, very friendly labrador who also uses the garden, as well as 2 cats. At the end of the garden is a workshop which we let to a local instrument-maker. He is usually quiet and keeps sociable hours. There are 3 of us staying in the main house - ourselves and a lodger.","Parking is free on our street, usually with plenty of available spaces outside the house. New Malden rail station is 15 mins walk away. We can offer lifts to & from if you wish. Waterloo is 25 mins from the station, and there are frequent local buses to Kingston-upon-Thames (15 mins) and surrounding towns. There is also a local bus route serving Heathrow Airport, or we can drive you to and from either Gatwick or Heathrow Airports for the cost of the fuel and a little for time if we are available.","The tent is a roomy Zempire Invert 6. We provide a back door key for use of the shared bathroom with both shower and bath. Continental breakfast is included, and can be served on our shady patio or on our sunny decked area. We have a conservatory dining room if raining/cold!","Our mobile will be on 24 hours a day, if you need to ask us anything at all while you are here. You may use the Conservatory for charging phones/laptops. The kitchen may be used for making hot drinks and toast only. There are many restaurants and takeaways of different kinds within 15 mins walk. The lounge is for our family use only.","Since there is only one bathroom/loo with several people sharing, we would expect everyone to be fairly flexible about its use. We will do our very best to accommodate your needs at any time of day.",https://a0.muscache.com/im/pictures/92404296/47b5dae2_original.jpg?aki_policy=small,https://a0.muscache.com/im/pictures/92404296/47b5dae2_original.jpg?aki_policy=medium,https://a0.muscache.com/im/pictures/92404296/47b5dae2_original.jpg?aki_policy=large,https://a0.muscache.com/im/pictures/92404296/47b5dae2_original.jpg?aki_policy=x_large,26831951,https://www.airbnb.com/users/show/26831951,Sara,2015-01-28,"New Malden, England, United Kingdom","My partner and myself are in our 50s, and enjoy B&B ing around the country.  We are a folk duo, both play guitar & sing, mostly at Folk Clubs & charity gigs, but do get the occasional paid one! We also love watching our favourite musicians 'live', especially at festivals. We enjoy seeing our 5 grown up children when we can, walking in the country, discovering local history and Real Ale.",within a day,100%,N/A,f,https://a0.muscache.com/im/users/26831951/profile_pic/1422439390/original.jpg?aki_policy=profile_small,https://a0.muscache.com/im/users/26831951/profile_pic/1422439390/original.jpg?aki_policy=profile_x_medium,RB of Kingston upon Thames,1,1,"['email', 'phone', 'reviews', 'jumio', 'government_id']",t,t,"Mount Pleasant Road, New Malden, KT3 3LA, United Kingdom",RB of Kingston upon Thames,Kingston upon Thames,,New Malden,,KT3 3LA,London,"New Malden, United Kingdom",GB,United Kingdom,51.40656688159754,-0.26902555603985046,t,Tent,Private room,2,1.0,1,1,Airbed,"{Internet,""Wireless Internet"",Breakfast,""Pets live on this property"",Dog(s),Cat(s),""Family/kid friendly"",Washer,""First aid kit"",""Fire extinguisher"",Essentials,Shampoo}",,$22.00,$130.00,$499.00,,,2,$10.00,2,1125,5 months ago,,3,25,55,330,2017-03-05,12,2015-07-19,2016-07-12,95,9,10,10,10,9,9,f,,,f,flexible,f,f,1,0.60
16185476,https://www.airbnb.com/rooms/16185476,20170304065726,2017-03-05,"Cosy room, Victorian house, easy access to London","My house is close to great shops, John Lewis and The Bentall Centre. Also the River Thames, Bars and Restaurants, Richmond Park, The Odeon Cinema and Ten Pin Bowling. Kingston Train Station is nearby with trains to London, Wimbledon, Richmond. The A3 gives access to London, Guildford and the Coast.","","My house is close to great shops, John Lewis and The Bentall Centre. Also the River Thames, Bars and Restaurants, Richmond Park, The Odeon Cinema and Ten Pin Bowling. Kingston Train Station is nearby with trains to London, Wimbledon, Richmond. The A3 gives access to London, Guildford and the Coast. Shared bathroom. I am not on site but can be called, text or emailed if you need anything. In particular, if you are staying for quite a while I can arrange for bed linen to be changed and breakfast groceries refreshed. I also know the area and London so I can try to help you to find what you are looking for if you need anything. Please do ask. Hampton Court Palace is a short bus journey away which is a great historical Royal Palace well worth a visit. There is a lovely little cafe opposite the house where you may wish to grab a coffee at some point. Plus there is a local supermarket just down the road. The shopping centre is 5-10 minutes walk as is the train into London. There is also a 15 ",none,"Hampton Court Palace is a short bus journey away which is a great historical Royal Palace well worth a visit. There is a lovely little cafe opposite the house where you may wish to grab a coffee at some point. Plus there is a local supermarket just down the road. The shopping centre is 5-10 minutes walk as is the train into London. There is also a 15 screen cinema and ten pin bowling and arcade complex  5-8 minutes walk away. Plus, lovely restaurants near the town and along the River Thames and Kingston has its own local theatre, The Rose Theatre, which hosts great plays if you don't want to go into London for theatre.","","Kingston Station to London Waterloo, Surbiton, Vauxhall and Clapham Junction is 5-8 minutes walk away. There are also local buses to Richmond 3 minutes walk at the end of the road.",Shared bathroom.,"I am not on site but can be called, text or emailed if you need anything. In particular, if you are staying for quite a while I can arrange for bed linen to be changed and breakfast groceries refreshed. I also know the area and London so I can try to help you to find what you are looking for if you need anything. Please do ask.",The room and house is no smoking and a quiet policy after 10 pm applies to all guests.,https://a0.muscache.com/im/pictures/bc747669-9ffd-4101-9745-be9a258841d4.jpg?aki_policy=small,https://a0.muscache.com/im/pictures/bc747669-9ffd-4101-9745-be9a258841d4.jpg?aki_policy=medium,https://a0.muscache.com/im/pictures/bc747669-9ffd-4101-9745-be9a258841d4.jpg?aki_policy=large,https://a0.muscache.com/im/pictures/bc747669-9ffd-4101-9745-be9a258841d4.jpg?aki_policy=x_large,83699073,https://www.airbnb.com/users/show/83699073,Gillian,2016-07-14,"London, England, United Kingdom","Happy, positive and Sociable. I know the local area and can recommend things to do and places to go. Hope you enjoy your stay in  Kingston and London",within an hour,100%,N/A,f,https://a0.muscache.com/im/pictures/92cddfd3-8ecb-4edc-8e33-b750d35d7611.jpg?aki_policy=profile_small,https://a0.muscache.com/im/pictures/92cddfd3-8ecb-4edc-8e33-b750d35d7611.jpg?aki_policy=profile_x_medium,,2,2,"['email', 'phone', 'facebook', 'reviews']",t,f,"King's Road, Kingston upon Thames, England KT2 5JH, United Kingdom",,Kingston upon Thames,,Kingston upon Thames,England,KT2 5JH,London,"Kingston upon Thames, United Kingdom",GB,United Kingdom,51.418204504020515,-0.2982593308324554,f,Bed & Breakfast,Private room,2,0.5,1,1,Real Bed,"{Internet,""Wireless Internet"",Heating,""Family/kid friendly"",""Smoke detector"",""Carbon monoxide detector"",Essentials,""Lock on bedroom door"",Iron,""translation missing: en.hosting_amenity_49""}",,$28.00,,,,$10.00,1,$10.00,1,1125,4 days ago,,5,35,65,340,2017-03-04,4,2017-01-01,2017-02-17,85,9,9,8,8,9,9,f,,,f,flexible,f,f,2,1.88
15926622,https://www.airbnb.com/rooms/15926622,20170304065726,2017-03-05,"Nice room, nice house, nice garden","We are 10 minutes away from Surbiton Station (by bus) or Tolworth Station (by foot). The bus stop is at the end of our road. By train we are 25 minutes to Waterloo - the heart of London. For nature lovers we are 25 mins to Hampton Court, Richmond Park, the River Thames, Wisely etc. We have a lovely, well decorated house, a beautiful garden and we are located in a quiet road. We are also close to local shops and a park too.","You will have a very nice, large room with a comfy sofa bed (or air mattress if you prefer). A desk, sofa, dvd player (plus dvds) etc. There is also a table with two chairs in your bedroom as well.","We are 10 minutes away from Surbiton Station (by bus) or Tolworth Station (by foot). The bus stop is at the end of our road. By train we are 25 minutes to Waterloo - the heart of London. For nature lovers we are 25 mins to Hampton Court, Richmond Park, the River Thames, Wisely etc. We have a lovely, well decorated house, a beautiful garden and we are located in a quiet road. We are also close to local shops and a park too. You will have a very nice, large room with a comfy sofa bed (or air mattress if you prefer). A desk, sofa, dvd player (plus dvds) etc. There is also a table with two chairs in your bedroom as well. There is a nice shower room next to your bedroom and you can use the garden. You can also use the washing machine once a day (we have detergent you can use). Someone will be available during your stay. We live in a safe neighbourhood. We are very close to transport links which will take you to London, Hampton etc We are happy to give advise on where you can go and what you",none,We live in a safe neighbourhood.,We are happy to give advise on where you can go and what you can do.,"We are very close to transport links which will take you to London, Hampton etc",There is a nice shower room next to your bedroom and you can use the garden. You can also use the washing machine once a day (we have detergent you can use).,Someone will be available during your stay.,"- We are sleeping here too, please be quiet after 9pm, thanks.",https://a0.muscache.com/im/pictures/002e971f-cf61-423e-9836-191fdfb3d573.jpg?aki_policy=small,https://a0.muscache.com/im/pictures/002e971f-cf61-423e-9836-191fdfb3d573.jpg?aki_policy=medium,https://a0.muscache.com/im/pictures/002e971f-cf61-423e-9836-191fdfb3d573.jpg?aki_policy=large,https://a0.muscache.com/im/pictures/002e971f-cf61-423e-9836-191fdfb3d573.jpg?aki_policy=x_large,66626449,https://www.airbnb.com/users/show/66626449,Juliet,2016-04-10,"Surbiton, England, United Kingdom","I love books, films, walking, travelling and spending time with my family and friends. I have one dog and two cats. I am honest and respectful.
I believe in looking after the environment and treating animals kindly.
I don't smoke and I am allergic to feathers and air fresheners. ",within a day,100%,N/A,f,https://a0.muscache.com/im/pictures/7a64892f-b63e-4261-b5fd-bffce70e529e.jpg?aki_policy=profile_small,https://a0.muscache.com/im/pictures/7a64892f-b63e-4261-b5fd-bffce70e529e.jpg?aki_policy=profile_x_medium,,1,1,"['email', 'phone', 'reviews']",t,f,"Lenelby Road, Surbiton, England KT6 7BH, United Kingdom",,Kingston upon Thames,,Surbiton,England,KT6 7BH,London,"Surbiton, United Kingdom",GB,United Kingdom,51.380421946538156,-0.28929656042455487,f,House,Private room,2,1.0,1,1,Real Bed,"{TV,""Wireless Internet"",Kitchen,""Free parking on premises"",""Pets allowed"",Breakfast,Heating,""Family/kid friendly"",Washer,Dryer,""Smoke detector"",""Carbon monoxide detector"",""First aid kit"",Essentials,Shampoo,Hangers,""Hair dryer"",Iron,""Laptop friendly workspace"",""translation missing: en.hosting_amenity_50""}",,$45.00,,,,,1,$0.00,2,14,2 months ago,,1,31,61,62,2017-03-04,0,,,,,,,,,,f,,,t,flexible,f,f,1,
10085459,https://www.airbnb.com/rooms/10085459,20170304065726,2017-03-05,Warm modern flat in Kingston,"2 bed Flat located walking distance to Richmond park,and Kingston town center with loads of great restaurants, street food and nightlife Quick train to London Express bus to Heathrow X26 Night bus N87 from central London stops in front of the flat","This modern and recently refurbished  flat consist of a master bedroom with of a double bed a large wardrobe and a desk. The 2nd bedroom consists of a single bed that can be opened and become a double bed, a wardrobe and a desk.","2 bed Flat located walking distance to Richmond park,and Kingston town center with loads of great restaurants, street food and nightlife Quick train to London Express bus to Heathrow X26 Night bus N87 from central London stops in front of the flat This modern and recently refurbished  flat consist of a master bedroom with of a double bed a large wardrobe and a desk. The 2nd bedroom consists of a single bed that can be opened and become a double bed, a wardrobe and a desk. Guests will have access to the entire flat that consists of 1 bedroom one bathroom, one kitchen, and one living room Only on arrival Kingston Upon Thames is a vibrant historic market town with loads of local independent shops restaurants riverside and beautiful parks X26 and 285 (24h) buses to and from Heathrow. Train to and from Gatwick via Clapham junction.  Night bus N87 from central London stops in front of the flat. Wi-Fi Washing machine Dish washer Smart TV NETFLIX Stereo",none,Kingston Upon Thames is a vibrant historic market town with loads of local independent shops restaurants riverside and beautiful parks,Wi-Fi Washing machine Dish washer Smart TV NETFLIX Stereo,X26 and 285 (24h) buses to and from Heathrow. Train to and from Gatwick via Clapham junction.  Night bus N87 from central London stops in front of the flat.,"Guests will have access to the entire flat that consists of 1 bedroom one bathroom, one kitchen, and one living room",Only on arrival,Please remove your shoes before walking on the carpet.,https://a0.muscache.com/im/pictures/681da370-8ef9-4407-9ef3-b139a15f8fc1.jpg?aki_policy=small,https://a0.muscache.com/im/pictures/681da370-8ef9-4407-9ef3-b139a15f8fc1.jpg?aki_policy=medium,https://a0.muscache.com/im/pictures/681da370-8ef9-4407-9ef3-b139a15f8fc1.jpg?aki_policy=large,https://a0.muscache.com/im/pictures/681da370-8ef9-4407-9ef3-b139a15f8fc1.jpg?aki_policy=x_large,15082436,https://www.airbnb.com/users/show/15082436,Paolo & Lia,2014-05-04,"London, United Kingdom",I love to travel and to spend time in nature.,within a few hours,100%,N/A,f,https://a0.muscache.com/im/pictures/b6a680bd-265e-4d76-9a4d-331fd44fa285.jpg?aki_policy=profile_small,https://a0.muscache.com/im/pictures/b6a680bd-265e-4d76-9a4d-331fd44fa285.jpg?aki_policy=profile_x_medium,,1,1,"['email', 'phone', 'facebook', 'reviews', 'jumio']",t,t,"Cambridge Rd, Kingston upon Thames, Surrey KT1 3NG, United Kingdom",,Kingston upon Thames,,Kingston upon Thames,Surrey,KT1 3NG,London,"Kingston upon Thames, United Kingdom",GB,United Kingdom,51.40986588350907,-0.2918745826885693,f,Apartment,Entire home/apt,4,1.0,2,2,Real Bed,"{TV,Kitchen,Heating,""Family/kid friendly"",Washer,""Smoke detector"",Essentials}",,$85.00,,,$200.00,$30.00,2,$15.00,5,1125,2 weeks ago,,20,21,21,21,2017-03-05,24,2016-01-03,2017-02-18,93,10,9,10,10,9,10,f,,,f,strict,f,f,1,1.68
