13857967,https://www.airbnb.com/rooms/13857967,20170304065726,2017-03-05,Small well designed single with high bed,"My place is close to Kingston University. You’ll love my place because of the neighbourhood, the outdoors space, the light, the ambiance. My place is good for solo adventurers.","A small well designed single with a high bed in a  quality house.  The property is in a very good family area of Surbiton, quiet and safe. Perfect location easy walking distance to Kingston, minutes from campus and 10 minutes walk to Surbiton mainline. The house has 4 double bedrooms as well as the  a well designed single. All have desks. The house has been well extended to incorporate a very communal large family room with well fitted kitchen, dining area and settees. It features off road parking on a shared drive and gardens front and back.  Its newly decorated.  Share with 3 others.","My place is close to Kingston University. You’ll love my place because of the neighbourhood, the outdoors space, the light, the ambiance. My place is good for solo adventurers. A small well designed single with a high bed in a  quality house.  The property is in a very good family area of Surbiton, quiet and safe. Perfect location easy walking distance to Kingston, minutes from campus and 10 minutes walk to Surbiton mainline. The house has 4 double bedrooms as well as the  a well designed single. All have desks. The house has been well extended to incorporate a very communal large family room with well fitted kitchen, dining area and settees. It features off road parking on a shared drive and gardens front and back.  Its newly decorated.  Share with 3 others. You will have access to your room and kitchen and all the communal areas Lots of friendly advice available Bookings end on 28 August no bookings possible after that.  I would prefer a long term stay.",none,"",Bookings end on 28 August no bookings possible after that.  I would prefer a long term stay.,"",You will have access to your room and kitchen and all the communal areas,Lots of friendly advice available,"",https://a0.muscache.com/im/pictures/87d2fcaa-8022-4019-bed1-9ef3b0a693ee.jpg?aki_policy=small,https://a0.muscache.com/im/pictures/87d2fcaa-8022-4019-bed1-9ef3b0a693ee.jpg?aki_policy=medium,https://a0.muscache.com/im/pictures/87d2fcaa-8022-4019-bed1-9ef3b0a693ee.jpg?aki_policy=large,https://a0.muscache.com/im/pictures/87d2fcaa-8022-4019-bed1-9ef3b0a693ee.jpg?aki_policy=x_large,8581542,https://www.airbnb.com/users/show/8581542,Lesley,2013-09-02,London,clear and considerate couple,N/A,N/A,N/A,f,https://a0.muscache.com/im/pictures/642c9bac-bce0-4971-b41b-04b65c3a195a.jpg?aki_policy=profile_small,https://a0.muscache.com/im/pictures/642c9bac-bce0-4971-b41b-04b65c3a195a.jpg?aki_policy=profile_x_medium,RB of Kingston upon Thames,1,1,"['email', 'phone']",t,f,"Cheyne Hill, Surbiton, KT5 8BL, United Kingdom",RB of Kingston upon Thames,Kingston upon Thames,,Surbiton,,KT5 8BL,,"Surbiton, United Kingdom",GB,United Kingdom,51.39883236179355,-0.2935390370447626,t,Apartment,Private room,1,1.5,1,1,Real Bed,"{""Wireless Internet"",Kitchen,""Free parking on premises"",""Smoking allowed"",Heating,""Suitable for events"",Washer,""Smoke detector"",""Carbon monoxide detector"",Essentials,Shampoo,""Lock on bedroom door"",Hangers,""Hair dryer"",Iron,""Laptop friendly workspace"",""translation missing: en.hosting_amenity_49"",""translation missing: en.hosting_amenity_50""}",,$40.00,,,$100.00,$10.00,1,$0.00,3,45,8 months ago,,29,59,89,89,2017-03-05,0,,,,,,,,,,f,,,t,flexible,f,f,1,
14541148,https://www.airbnb.com/rooms/14541148,20170304065726,2017-03-05,1 double room in Surbiton close to station,"Moja oferta jest w pobliżu: shops, river, restaurant, train station, 18min to london waterloo. Moje miejsce jest dobre dla: pary, przygody solo, podróżujący w interesach ","","Moja oferta jest w pobliżu: shops, river, restaurant, train station, 18min to london waterloo. Moje miejsce jest dobre dla: pary, przygody solo, podróżujący w interesach",none,"","","","","","",https://a0.muscache.com/im/pictures/16df311e-83d0-430d-b158-a8babd9332f1.jpg?aki_policy=small,https://a0.muscache.com/im/pictures/16df311e-83d0-430d-b158-a8babd9332f1.jpg?aki_policy=medium,https://a0.muscache.com/im/pictures/16df311e-83d0-430d-b158-a8babd9332f1.jpg?aki_policy=large,https://a0.muscache.com/im/pictures/16df311e-83d0-430d-b158-a8babd9332f1.jpg?aki_policy=x_large,65568682,https://www.airbnb.com/users/show/65568682,Dominika,2016-04-03,"London, England, United Kingdom","",N/A,N/A,N/A,f,https://a0.muscache.com/im/pictures/6ec26b5f-d662-4fca-b2a7-8bc004b6ba7b.jpg?aki_policy=profile_small,https://a0.muscache.com/im/pictures/6ec26b5f-d662-4fca-b2a7-8bc004b6ba7b.jpg?aki_policy=profile_x_medium,,2,2,"['email', 'phone', 'reviews', 'jumio', 'government_id']",t,t,"Grove Road, Surbiton, England KT6 4BY, United Kingdom",,Kingston upon Thames,,Surbiton,England,KT6 4BY,London,"Surbiton, United Kingdom",GB,United Kingdom,51.39762068606377,-0.3081289676411627,f,Apartment,Private room,2,1.0,1,1,Real Bed,"{""Wireless Internet"",Kitchen,""Pets allowed"",Heating,""Family/kid friendly"",Washer,""Smoke detector"",Essentials,Hangers}",,$50.00,,,,,1,$0.00,1,1125,3 months ago,,0,0,0,63,2017-03-05,2,2016-08-19,2016-08-27,80,10,10,10,10,10,10,f,,,t,flexible,f,f,2,0.30
14296637,https://www.airbnb.com/rooms/14296637,20170304065726,2017-03-05,Double room in cozy friendly flat ;-),"My place is situated about 10-15mins walking distance from Kingston city centre where you can have access to various restaurants and bars. I'm surrounding by University campuses,hospital,train station,Postoffice,local bars and access to all public transport including Bus,Train and Taxi. Kingston is a great place for night out people including families & friends.You’ll love my place because of the comfy bed and the cosiness. My place is good for couples, solo adventurers, and business travellers.","","My place is situated about 10-15mins walking distance from Kingston city centre where you can have access to various restaurants and bars. I'm surrounding by University campuses,hospital,train station,Postoffice,local bars and access to all public transport including Bus,Train and Taxi. Kingston is a great place for night out people including families & friends.You’ll love my place because of the comfy bed and the cosiness. My place is good for couples, solo adventurers, and business travellers.",none,"","","","","","",https://a0.muscache.com/im/pictures/e9635b62-94d2-4ce5-a2b6-8e7afda161bb.jpg?aki_policy=small,https://a0.muscache.com/im/pictures/e9635b62-94d2-4ce5-a2b6-8e7afda161bb.jpg?aki_policy=medium,https://a0.muscache.com/im/pictures/e9635b62-94d2-4ce5-a2b6-8e7afda161bb.jpg?aki_policy=large,https://a0.muscache.com/im/pictures/e9635b62-94d2-4ce5-a2b6-8e7afda161bb.jpg?aki_policy=x_large,34769575,https://www.airbnb.com/users/show/34769575,Patrick,2015-06-01,"Kingston upon Thames, England, United Kingdom","Hi there, I am Patrick ;-)
I am a third year Engineering student based in Kingston, London. I've spent a lot of time travelling around during holidays and internship so I understand what people need when they're away from home. I personally love London,  so I'm trying help people/visitors make the most of their stay by renting out my lovely room. ;-)",within a day,100%,N/A,f,https://a0.muscache.com/im/pictures/27fc1d7b-dc1e-4ed0-83b3-7123b4f4c46c.jpg?aki_policy=profile_small,https://a0.muscache.com/im/pictures/27fc1d7b-dc1e-4ed0-83b3-7123b4f4c46c.jpg?aki_policy=profile_x_medium,RB of Kingston upon Thames,2,2,"['email', 'phone', 'reviews', 'jumio', 'government_id']",t,t,"Abinger House, Kingsnympton Park, Kingston upon Thames, England KT2 7RW, United Kingdom",RB of Kingston upon Thames,Kingston upon Thames,,Kingston upon Thames,England,KT2 7RW,London,"Kingston upon Thames, United Kingdom",GB,United Kingdom,51.42132258620232,-0.2783671858375879,t,Apartment,Private room,1,1.0,1,1,Real Bed,"{TV,""Wireless Internet"",Kitchen,""Free parking on premises"",Breakfast,Heating,""Family/kid friendly"",Washer,Dryer,""Smoke detector"",""First aid kit"",Essentials,""Lock on bedroom door"",Hangers,""Hair dryer"",Iron,""Laptop friendly workspace""}",,$23.00,,,,$10.00,1,$10.00,1,15,2 months ago,,0,0,0,216,2017-03-05,2,2016-09-10,2016-09-10,100,10,10,10,10,10,10,f,,,f,strict,f,f,2,0.34
13844847,https://www.airbnb.com/rooms/13844847,20170304065726,2017-03-05,Luxury flat in peaceful area and close to london,"My place is good for couples, solo adventurers, business travelers, and families (with kids). I have a single and a double room available.","My place is 2 mins away from the station, which has direct links to central london. (20mins to London Waterloo)","My place is good for couples, solo adventurers, business travelers, and families (with kids). I have a single and a double room available. My place is 2 mins away from the station, which has direct links to central london. (20mins to London Waterloo) Kitchen, Toilet and Bedroom",none,"","","","Kitchen, Toilet and Bedroom","","",https://a0.muscache.com/im/pictures/1239285d-6b55-42ab-ab21-d6b6bb99d6bb.jpg?aki_policy=small,https://a0.muscache.com/im/pictures/1239285d-6b55-42ab-ab21-d6b6bb99d6bb.jpg?aki_policy=medium,https://a0.muscache.com/im/pictures/1239285d-6b55-42ab-ab21-d6b6bb99d6bb.jpg?aki_policy=large,https://a0.muscache.com/im/pictures/1239285d-6b55-42ab-ab21-d6b6bb99d6bb.jpg?aki_policy=x_large,47654068,https://www.airbnb.com/users/show/47654068,Asad,2015-10-28,"England, United Kingdom","",within an hour,100%,N/A,f,https://a0.muscache.com/im/pictures/6fde9b09-0bb8-4af5-991a-9415064edc77.jpg?aki_policy=profile_small,https://a0.muscache.com/im/pictures/6fde9b09-0bb8-4af5-991a-9415064edc77.jpg?aki_policy=profile_x_medium,,1,1,"['email', 'phone', 'reviews']",t,f,"Ewell Road, Surbiton, KT6 6HZ, United Kingdom",,Kingston upon Thames,,Surbiton,,KT6 6HZ,London,"Surbiton, United Kingdom",GB,United Kingdom,51.39278945492196,-0.30367945204877966,f,Apartment,Private room,2,1.0,1,2,Real Bed,"{Internet,""Wireless Internet"",Kitchen,""Free parking on premises"",Heating,""Family/kid friendly"",Washer,Dryer,Essentials,Shampoo,Hangers,Iron}",,$35.00,,,,$20.00,1,$25.00,1,1125,2 months ago,,18,48,78,353,2017-03-05,4,2016-09-18,2017-01-30,70,7,7,9,10,9,7,f,,,t,flexible,f,f,1,0.71
6222799,https://www.airbnb.com/rooms/6222799,20170304065726,2017-03-05,"Loft room in Victorian house, near Richmond Park","Sunny ensuite room in the newly converted loft. Richmond Park is less than 200m away, and Kingston town centre and the river Thames are a 15min walk, or a short bus ride. The nearest station is a 10min walk, and takes 25mins to London.","The room is in the newly converted loft and has windows on all aspects making it the sunniest room in the house. A roomy bathroom comprises of a large walk in shower, loo and sink with a window overlooking the garden. The room has a double bed, area to sit and relax and a novel additional bed in the eaves - perfect for children, but big enough for an adult.","Sunny ensuite room in the newly converted loft. Richmond Park is less than 200m away, and Kingston town centre and the river Thames are a 15min walk, or a short bus ride. The nearest station is a 10min walk, and takes 25mins to London. The room is in the newly converted loft and has windows on all aspects making it the sunniest room in the house. A roomy bathroom comprises of a large walk in shower, loo and sink with a window overlooking the garden. The room has a double bed, area to sit and relax and a novel additional bed in the eaves - perfect for children, but big enough for an adult. Your room is at the top of the house and has plenty of room to relax in but you are also welcome to join us in the kitchen and to enjoy the garden. I/we will be available to greet you and welcome you to our home. You will be invited to join us for refreshments and supply you with all the information you will need about the house and area. Richmond Park is at the end of the road and is the largest Roya",none,"Richmond Park is at the end of the road and is the largest Royal Park in London covering an area of 2,500 acres. From our house you can cycle through the park towards Richmond and stop to view St Paul's Cathedral from outside Pembroke Lodge, 12 miles away. On arriving at the top of Richmond hill you can enjoy the famous view over the Thames enjoyed by Turner, and as far as Windsor Castle on a clear day.  Or alternatively head into Kingston and along the Thames, which will take you to Ham house, then Richmond in one direction and Hampton Court in the other, in high season you can catch a boat in either direction. Perfect location for Hampton Court flower show or the tennis in Wimbledon","• Table tennis.  • We have bikes available for you to use which makes the local area accessible • We have a dog, Eva a miniature schnauzer who is very friendly and welcoming (but sometimes she's in Wales).","Kingston centre and train station is a 15min walk away, with Norbiton train station being slightly closer, about 10min. From the end of the road the 371 bus goes to Kingston in one direction and to Richmond, via Ham and Petersham in the other direction. We have 2 bikes available for you to use, as there are lots of areas to explore by bike.",Your room is at the top of the house and has plenty of room to relax in but you are also welcome to join us in the kitchen and to enjoy the garden.,I/we will be available to greet you and welcome you to our home. You will be invited to join us for refreshments and supply you with all the information you will need about the house and area.,Please respect our house as you would your own. We ask that you take off your shoes when you enter the house.,https://a0.muscache.com/im/pictures/4da2237d-2335-4d9e-affe-77cb7dadc7aa.jpg?aki_policy=small,https://a0.muscache.com/im/pictures/4da2237d-2335-4d9e-affe-77cb7dadc7aa.jpg?aki_policy=medium,https://a0.muscache.com/im/pictures/4da2237d-2335-4d9e-affe-77cb7dadc7aa.jpg?aki_policy=large,https://a0.muscache.com/im/pictures/4da2237d-2335-4d9e-affe-77cb7dadc7aa.jpg?aki_policy=x_large,32264660,https://www.airbnb.com/users/show/32264660,Alison,2015-04-30,"Kingston upon Thames, England, United Kingdom","",within an hour,100%,N/A,t,https://a0.muscache.com/im/users/32264660/profile_pic/1439815093/original.jpg?aki_policy=profile_small,https://a0.muscache.com/im/users/32264660/profile_pic/1439815093/original.jpg?aki_policy=profile_x_medium,RB of Kingston upon Thames,1,1,"['email', 'phone', 'reviews']",t,f,"Tudor Road, Kingston upon Thames, KT2 6AS, United Kingdom",RB of Kingston upon Thames,Kingston upon Thames,,Kingston upon Thames,,KT2 6AS,London,"Kingston upon Thames, United Kingdom",GB,United Kingdom,51.419414956447895,-0.28824497512875824,t,House,Private room,3,1.0,1,1,Real Bed,"{TV,""Cable TV"",""Wireless Internet"",""Pets allowed"",Breakfast,Heating,""Family/kid friendly"",Washer,""Smoke detector"",""Carbon monoxide detector"",""First aid kit"",""Safety card"",Essentials,Shampoo,""Lock on bedroom door"",Hangers,""Hair dryer"",Iron,""translation missing: en.hosting_amenity_50""}",,$45.00,,,,$8.00,1,$10.00,1,1125,today,,1,20,38,268,2017-03-04,12,2016-06-11,2017-02-16,100,10,10,10,10,10,10,f,,,f,moderate,f,f,1,1.34
15421169,https://www.airbnb.com/rooms/15421169,20170304065726,2017-03-05,Clean place and amazing location.,"The place is situated next to accessible shopes and pub live music during the week and weekends. Surbiton train station is 10 minutes away, buses just in front of the main door.","","The place is situated next to accessible shopes and pub live music during the week and weekends. Surbiton train station is 10 minutes away, buses just in front of the main door.",none,"","","","","",Respect other guests around. And keep the flat clean thanks.,https://a0.muscache.com/im/pictures/85982255-7c49-4089-a5d4-1a4148dd34b5.jpg?aki_policy=small,https://a0.muscache.com/im/pictures/85982255-7c49-4089-a5d4-1a4148dd34b5.jpg?aki_policy=medium,https://a0.muscache.com/im/pictures/85982255-7c49-4089-a5d4-1a4148dd34b5.jpg?aki_policy=large,https://a0.muscache.com/im/pictures/85982255-7c49-4089-a5d4-1a4148dd34b5.jpg?aki_policy=x_large,97756975,https://www.airbnb.com/users/show/97756975,Sam,2016-10-03,GB,"",within an hour,71%,N/A,f,https://a0.muscache.com/im/pictures/dbacbbaf-0726-4e15-bf05-fdcaaa7e334f.jpg?aki_policy=profile_small,https://a0.muscache.com/im/pictures/dbacbbaf-0726-4e15-bf05-fdcaaa7e334f.jpg?aki_policy=profile_x_medium,,1,1,"['phone', 'reviews']",t,f,"A Berrylands Road, Surbiton, England KT5 8RA, United Kingdom",,Kingston upon Thames,,Surbiton,England,KT5 8RA,London,"Surbiton, United Kingdom",GB,United Kingdom,51.39395505344963,-0.29623053236825925,f,Apartment,Private room,2,1.0,1,1,Real Bed,"{""Wireless Internet"",Kitchen,""Free parking on premises"",""Smoking allowed"",Heating,""Family/kid friendly"",""Suitable for events"",""Fire extinguisher""}",,$40.00,,,,,1,$0.00,2,3,4 months ago,,30,60,90,365,2017-03-05,1,2016-10-28,2016-12-20,100,10,10,10,10,10,10,f,,,f,flexible,f,f,1,0.23
1765414,https://www.airbnb.com/rooms/1765414,20170304065726,2017-03-05,Only 20 minutes from Waterloo,A lovely double room to rent in a Georgian style house.  The room has a comfortable double bed and guests will have access to the house including a lovely sunny conservatory.  15 minutes walk you can take a 20 minute train direct to London Waterloo.,"Room to rent in a detached house.  Provides quick access to the centre of london yet close to one of london's most beautiful parks -  Richmond Park.  20 minutes train journey will take you to waterloo where you will have access to some of of the most famous landmarks in the world, theatre land, exhibitions, galleries and of course shopping.","A lovely double room to rent in a Georgian style house.  The room has a comfortable double bed and guests will have access to the house including a lovely sunny conservatory.  15 minutes walk you can take a 20 minute train direct to London Waterloo. Room to rent in a detached house.  Provides quick access to the centre of london yet close to one of london's most beautiful parks -  Richmond Park.  20 minutes train journey will take you to waterloo where you will have access to some of of the most famous landmarks in the world, theatre land, exhibitions, galleries and of course shopping. Most of the house including kitchen and living room Will in general be present or available. ",social,"","","",Most of the house including kitchen and living room,Will in general be present or available. ,"",https://a0.muscache.com/im/pictures/24946813/091282fd_original.jpg?aki_policy=small,https://a0.muscache.com/im/pictures/24946813/091282fd_original.jpg?aki_policy=medium,https://a0.muscache.com/im/pictures/24946813/091282fd_original.jpg?aki_policy=large,https://a0.muscache.com/im/pictures/24946813/091282fd_original.jpg?aki_policy=x_large,4755566,https://www.airbnb.com/users/show/4755566,Anita,2013-01-18,"Kingston upon Thames, England, United Kingdom",Female,N/A,N/A,N/A,f,https://a0.muscache.com/im/users/4755566/profile_pic/1381147435/original.jpg?aki_policy=profile_small,https://a0.muscache.com/im/users/4755566/profile_pic/1381147435/original.jpg?aki_policy=profile_x_medium,RB of Kingston upon Thames,1,1,"['email', 'phone', 'reviews']",t,f,"Cotswold Close, Kingston upon Thames, KT2 7JN, United Kingdom",RB of Kingston upon Thames,Kingston upon Thames,,Kingston upon Thames,,KT2 7JN,London,"Kingston upon Thames, United Kingdom",GB,United Kingdom,51.4228678792934,-0.27488277275824535,t,House,Private room,2,1.0,1,1,Real Bed,"{TV,Internet,""Wireless Internet"",Kitchen,""Free parking on premises"",Heating,Washer,Dryer}",,$60.00,,,,,1,$0.00,1,1125,6 months ago,,30,60,90,365,2017-03-04,4,2015-11-07,2016-08-17,100,10,10,10,10,10,10,f,,,f,flexible,f,f,1,0.25
6290335,https://www.airbnb.com/rooms/6290335,20170304065726,2017-03-05,Spacious private garden studio.,"This spacious garden studio is a private, bright, quiet haven. Self contained bathroom and kitchen perfect for one or two guests. Access through side gate through the garden. 10 min. walk to Norbiton station or 20 min. stroll to centre of Kingston.","This private garden studio is a self contained unit with some space outside to sit and sip your morning coffee should you wish to.  The space is bright thanks to a top skylight and being tucked away in the garden tends to be very quiet. It comes with a fairly chunky library of books on architecture and some travel magazines.  This is a self catered accommodation with fully functioning kitchen but simple breakfast supplies can be provided for your convenience at request and extra cost (receipt will be included). Tea, coffee, sugar, olive oil and basic spices are provided.  There is usually someone in the house if you need any assistance but I tend to give my guests peace and quite to relax. I am available outside of working hours and on the weekends and any time on my mobile.  Guests will be provided with towels and fresh bedding. With longer stays fresh bedding and towels will be provided on weekly basis.  I am more than happy to negotiate on price for extended stays of over a month. T","This spacious garden studio is a private, bright, quiet haven. Self contained bathroom and kitchen perfect for one or two guests. Access through side gate through the garden. 10 min. walk to Norbiton station or 20 min. stroll to centre of Kingston. This private garden studio is a self contained unit with some space outside to sit and sip your morning coffee should you wish to.  The space is bright thanks to a top skylight and being tucked away in the garden tends to be very quiet. It comes with a fairly chunky library of books on architecture and some travel magazines.  This is a self catered accommodation with fully functioning kitchen but simple breakfast supplies can be provided for your convenience at request and extra cost (receipt will be included). Tea, coffee, sugar, olive oil and basic spices are provided.  There is usually someone in the house if you need any assistance but I tend to give my guests peace and quite to relax. I am available outside of working hours and on the w",none,"Kingston is a small but lively borough, which is steeped in history that is reflected throughout the town. There are many green spaces and convenient transport into centre of London via the overground.","","",Guests will have access to the studio as described via side gate and patio outside the studio.,I tend to give my guest plenty of space.,This tends to be a quiet neighbourhood so I expect guests to keep the music on medium.  I'm afraid that although I like pets I don't like them in the house so not pets allowed.  No smoking in the studio please. Other than that have fun.,https://a0.muscache.com/im/pictures/a28f5067-8ce8-4f05-bfcd-7c1125b8a2f2.jpg?aki_policy=small,https://a0.muscache.com/im/pictures/a28f5067-8ce8-4f05-bfcd-7c1125b8a2f2.jpg?aki_policy=medium,https://a0.muscache.com/im/pictures/a28f5067-8ce8-4f05-bfcd-7c1125b8a2f2.jpg?aki_policy=large,https://a0.muscache.com/im/pictures/a28f5067-8ce8-4f05-bfcd-7c1125b8a2f2.jpg?aki_policy=x_large,32702986,https://www.airbnb.com/users/show/32702986,Kinga,2015-05-05,"Kingston upon Thames, England, United Kingdom","",within a day,100%,N/A,f,https://a0.muscache.com/im/users/32702986/profile_pic/1430864852/original.jpg?aki_policy=profile_small,https://a0.muscache.com/im/users/32702986/profile_pic/1430864852/original.jpg?aki_policy=profile_x_medium,RB of Kingston upon Thames,1,1,"['email', 'phone', 'reviews', 'jumio']",t,t,"Waters Rd, Kingston upon Thames, Surrey KT1 3LW, United Kingdom",RB of Kingston upon Thames,Kingston upon Thames,,Kingston upon Thames,Surrey,KT1 3LW,London,"Kingston upon Thames, United Kingdom",GB,United Kingdom,51.40917416628107,-0.2829154904501622,t,Chalet,Private room,2,1.0,1,1,Real Bed,"{TV,Internet,""Wireless Internet"",Kitchen,""Pets live on this property"",Cat(s),Heating,""Smoke detector"",""Fire extinguisher"",Essentials,Hangers,""Hair dryer"",Iron,""Laptop friendly workspace"",""translation missing: en.hosting_amenity_50""}",,$60.00,,,,,1,$0.00,1,1125,6 weeks ago,,0,0,2,189,2017-03-05,12,2015-06-19,2015-09-21,90,9,9,10,10,8,9,f,,,f,flexible,f,f,1,0.58
