id,listing_url,scrape_id,last_scraped,name,summary,space,description,experiences_offered,neighborhood_overview,notes,transit,access,interaction,house_rules,thumbnail_url,medium_url,picture_url,xl_picture_url,host_id,host_url,host_name,host_since,host_location,host_about,host_response_time,host_response_rate,host_acceptance_rate,host_is_superhost,host_thumbnail_url,host_picture_url,host_neighbourhood,host_listings_count,host_total_listings_count,host_verifications,host_has_profile_pic,host_identity_verified,street,neighbourhood,neighbourhood_cleansed,neighbourhood_group_cleansed,city,state,zipcode,market,smart_location,country_code,country,latitude,longitude,is_location_exact,property_type,room_type,accommodates,bathrooms,bedrooms,beds,bed_type,amenities,square_feet,price,weekly_price,monthly_price,security_deposit,cleaning_fee,guests_included,extra_people,minimum_nights,maximum_nights,calendar_updated,has_availability,availability_30,availability_60,availability_90,availability_365,calendar_last_scraped,number_of_reviews,first_review,last_review,review_scores_rating,review_scores_accuracy,review_scores_cleanliness,review_scores_checkin,review_scores_communication,review_scores_location,review_scores_value,requires_license,license,jurisdiction_names,instant_bookable,cancellation_policy,require_guest_profile_picture,require_guest_phone_verification,calculated_host_listings_count,reviews_per_month
15896822,https://www.airbnb.com/rooms/15896822,20170304065726,2017-03-05,Double room in newly refurbished flat,"My place is close to TK Max, John Lewis, Marks and Spencer, Saisbury's,   Riverside Walk, Busaba Eathai Kingston Riverside, Local Hero, CAU Kingston, Ancient Market. You’ll love my place because of the variety of places to go to nearby, it's within 2 min walk from the river, the comfy bed.. My place is good for solo adventurers.","","My place is close to TK Max, John Lewis, Marks and Spencer, Saisbury's,   Riverside Walk, Busaba Eathai Kingston Riverside, Local Hero, CAU Kingston, Ancient Market. You’ll love my place because of the variety of places to go to nearby, it's within 2 min walk from the river, the comfy bed.. My place is good for solo adventurers.",none,"","","","","","- Keep clean and tidy. Be respectful to the other occupant. No smoking in the room. Be mindful about damaging  the carpet or any other furniture, or any personal items that belong to the room/flat. - Sharing with an easy-going and friendly occupant. Perfect place to stay for work or leisure trips. - Clean, modern and comfortable place to stay. You will be amazed of the variety of places you can explore nearby. Good and safe environment in the heart of Kingston, close to shops, bars, restaurants, cafes, cinemas, and sport facilities.",https://a0.muscache.com/im/pictures/1d9cad1f-ac6f-40b6-9b01-c6edff0d1054.jpg?aki_policy=small,https://a0.muscache.com/im/pictures/1d9cad1f-ac6f-40b6-9b01-c6edff0d1054.jpg?aki_policy=medium,https://a0.muscache.com/im/pictures/1d9cad1f-ac6f-40b6-9b01-c6edff0d1054.jpg?aki_policy=large,https://a0.muscache.com/im/pictures/1d9cad1f-ac6f-40b6-9b01-c6edff0d1054.jpg?aki_policy=x_large,69018624,https://www.airbnb.com/users/show/69018624,Dafina,2016-04-26,"London, England, United Kingdom","",within a day,100%,N/A,f,https://a0.muscache.com/im/pictures/3aa93e9d-07c6-4527-9f76-2115385cf506.jpg?aki_policy=profile_small,https://a0.muscache.com/im/pictures/3aa93e9d-07c6-4527-9f76-2115385cf506.jpg?aki_policy=profile_x_medium,RB of Kingston upon Thames,1,1,"['email', 'phone', 'facebook']",t,f,"A Thames Street, Kingston upon Thames, England KT1 1PE, United Kingdom",RB of Kingston upon Thames,Kingston upon Thames,,Kingston upon Thames,England,KT1 1PE,London,"Kingston upon Thames, United Kingdom",GB,United Kingdom,51.41003565850805,-0.30632295293010353,t,Apartment,Private room,1,1.0,1,1,Real Bed,"{""Wireless Internet"",Kitchen,Washer,""Smoke detector"",""Laptop friendly workspace"",""translation missing: en.hosting_amenity_49"",""translation missing: en.hosting_amenity_50""}",,$23.00,,,,,1,$8.00,7,1125,6 weeks ago,,1,31,61,61,2017-03-05,1,2016-12-03,2016-12-03,100,10,10,10,10,10,10,f,,,f,flexible,f,f,1,0.32
4836957,https://www.airbnb.com/rooms/4836957,20170304065726,2017-03-05,Modern room 25m from Central London,"This lovely spacious double bedroom is set in a beautiful location at the heart of family friendly, green and alive Kingston (southwest Greater London- zone 6). Guests will have their private room sharing bathroom and Kitchen with late 20s couple","////*** This Price include Parking but not Kitchen ****///// This lovely spacious double bedroom is set in a beautiful location at the heart of family friendly, green and alive Kingston (southwest Greater London- zone 6). The guests will have their private room in a shared modern apartment. You can use an extra futon bed if you are three persons (please do let us know so we can organise the room). The toilet and bathroom will be shared and is very spacious too. The kitchen can be used to cook. The famous Richmond park, one of the biggest national reserve of England is only 10 mins walking distance from us, there you will enjoy the wild deer and other animals, you can cycle, picnic... You will find an attractive town center in Kingston, full of great restaurants and a walk by the river is fully recommended! Kingston is very alive and well known for its great shopping. We are an international working couple, very friendly and available to help you in terms of tourism to get the best jour","This lovely spacious double bedroom is set in a beautiful location at the heart of family friendly, green and alive Kingston (southwest Greater London- zone 6). Guests will have their private room sharing bathroom and Kitchen with late 20s couple ////*** This Price include Parking but not Kitchen ****///// This lovely spacious double bedroom is set in a beautiful location at the heart of family friendly, green and alive Kingston (southwest Greater London- zone 6). The guests will have their private room in a shared modern apartment. You can use an extra futon bed if you are three persons (please do let us know so we can organise the room). The toilet and bathroom will be shared and is very spacious too. The kitchen can be used to cook. The famous Richmond park, one of the biggest national reserve of England is only 10 mins walking distance from us, there you will enjoy the wild deer and other animals, you can cycle, picnic... You will find an attractive town center in Kingston, full of",family,"Kingston upon Thames is a vibrant Surrey market town at the heart one of London’s liveliest boroughs. The town is in a beautiful location as it nestles on the banks of the River Thames and, as it’s just 12 miles south west of central London, it’s the ideal place to escape to from the City. Kingston boasts everything you would expect from a thriving market town including superb shopping, a vibrant café culture, a well respected university and a great nightlife. Events in Kingston include a packed schedule of art, music, theatre and family events throughout the year, so whenever you visit Kingston you’ll find plenty to do. Kingston’s history dates back to 838 when the town was first recorded in a royal document, and by the tenth century the town made its mark on history when it became a coronation place for Anglo Saxon kings. Kingston Town Centre retains much of its historic past including beautiful Tudor buildings, the Ancient Market and All Saints Church. Today, an exciting mix of them",Guests can in advance ask for any help they might need and we will definitely help ,Transport:  10 mins walk to overground station Norbiton 25 mins to Waterloo station  Bus stop in front of the building with two 24/7 buses. Parking is not available yet guests can park in some free parking spots 5 mins from our flat  We are 45 mins from Heathrow airport by bus X26 (tickets are max 2£ and no more cash is accepted on London buses)  From Gatwick airport:  1- Train to Clapham Junction Station from the airport and then another train to Norbiton Station  approximately an hour journey  2- Taxi is about 30-40 £  From Luton Airport it takes 2-3 hours  take the bus to Victoria Station  take the Victoria Line to Vauxhall station  take the South West trains to Norbiton  Stansted airport: 2-3 hours  take the Train to Liverpool street station and stop in Tottenham Hale  Walk to Tottenham hale station  take the victoria line to Vauxhall take the south west trains to Norbiton  ,"Spacious living room with King size sofa bed+dining table + internet + shared Kitchen and Bathroom. Attractions: Richmond Park 15 mins walk  Thames River side 15 mins walk  Kingston market Hampton Court Castle(25 mins walking) cycling 15 mins (amazing route along the river)      NO Smoking inside though you have access to a communal garden or the garage to have a Cig NO Pets allowed: :-( our building does not allow that. check in times are quite flexible but need to be agreed in advance, preferably check in after 8 pm and before midnight. We can provide breakfast (English, French, Austrian, Lebanese) for extra 5£ per person based on prearrangement.           ","We usually provide  warm welcome to our guests if their arrival time doesn't conflict with our work schedule.  We provide help and guidance to our guests. Our guests are welcome to use our maps, guides which comes in 3 languages English, French and German.     ",No smoking No Pets  Please ask before using any amenities that was not agreed before Deal with it as your own room,https://a0.muscache.com/im/pictures/61075138/4a348eb4_original.jpg?aki_policy=small,https://a0.muscache.com/im/pictures/61075138/4a348eb4_original.jpg?aki_policy=medium,https://a0.muscache.com/im/pictures/61075138/4a348eb4_original.jpg?aki_policy=large,https://a0.muscache.com/im/pictures/61075138/4a348eb4_original.jpg?aki_policy=x_large,18154504,https://www.airbnb.com/users/show/18154504,Anas,2014-07-15,London,"We are a professional working couple in our late 20s, enjoy having guests from all over the world as we have been renting our room on (SENSITIVE CONTENTS HIDDEN) for a while. Our lovely spacious double bedroom is set in a beautiful location at the heart of family friendly, green and alive Kingston (southwest Greater London- zone 6). The guests will have their private room in a shared modern apartment. You can use an extra futon bed if you are three persons (please do let us know so we can organise the room). The toilet and bathroom will be shared and is very spacious too. The kitchen can be used to cook. The famous Richmond park, one of the biggest national reserve of England is only 10 mins walking distance from us, there you will enjoy the wild deer and other animals, you can cycle, picnic... You will find an attractive town center in Kingston, full of great restaurants and a walk by the river is fully recommended! Kingston is very alive and well known for its great shopping. We are an international working couple, very friendly and available to help you in terms of tourism to get the best journey ever in London. We are also speaking 4 languages fluently, which includes french, german and arabic.

Transportation:
Only 30 mins by taxi from Heathrow airport and Gatwick airport.
Bus 57 and 85 right in front of the door.
Train station Norbiton or Kingston only 5 minutes walking distance, the trains are running every 10-15 minutes and going directly to Waterloo (London Eye) in just under 25 minutes.

We are only 25 minutes away from central London, by direct train line, and 15 minutes by bus to Wimbledon.
       ",within a few hours,100%,N/A,f,https://a0.muscache.com/im/users/18154504/profile_pic/1419169660/original.jpg?aki_policy=profile_small,https://a0.muscache.com/im/users/18154504/profile_pic/1419169660/original.jpg?aki_policy=profile_x_medium,RB of Kingston upon Thames,1,1,"['email', 'phone', 'reviews', 'jumio']",t,t,"London Road, Kingston upon Thames, Greater London KT2 6QS, United Kingdom",RB of Kingston upon Thames,Kingston upon Thames,,Kingston upon Thames,Greater London,KT2 6QS,London,"Kingston upon Thames, United Kingdom",GB,United Kingdom,51.411482167136185,-0.29070407496948214,t,Apartment,Private room,2,1.0,1,1,Pull-out Sofa,"{TV,Internet,""Wireless Internet"",""Free parking on premises"",""Elevator in building"",Heating,""Family/kid friendly"",""Smoke detector"",Essentials,""translation missing: en.hosting_amenity_49""}",,$50.00,$300.00,,,,1,$0.00,1,1125,5 months ago,,29,59,89,364,2017-03-04,15,2015-05-03,2016-09-07,91,9,9,10,9,9,10,f,,,f,moderate,f,f,1,0.67
13355982,https://www.airbnb.com/rooms/13355982,20170304065726,2017-03-05,Lovely double bedroom in Kingston Upon Thames,"Spacious double bedroom, because of the light, comfy bed, relaxing environment and spacious rooms with high ceilings. Excellent travel links as Feltham Station is just 5 minutes walk away to take a fast train to Central London (Waterloo Station). Bus stops in front of property for direct buses to Hea The access to central London is 15 minutes by train. The house is near Norbiton train station.","","Spacious double bedroom, because of the light, comfy bed, relaxing environment and spacious rooms with high ceilings. Excellent travel links as Feltham Station is just 5 minutes walk away to take a fast train to Central London (Waterloo Station). Bus stops in front of property for direct buses to Hea The access to central London is 15 minutes by train. The house is near Norbiton train station.",none,"","","","","","",https://a0.muscache.com/im/pictures/32875a5a-abd3-41bd-b861-d12dcb701e45.jpg?aki_policy=small,https://a0.muscache.com/im/pictures/32875a5a-abd3-41bd-b861-d12dcb701e45.jpg?aki_policy=medium,https://a0.muscache.com/im/pictures/32875a5a-abd3-41bd-b861-d12dcb701e45.jpg?aki_policy=large,https://a0.muscache.com/im/pictures/32875a5a-abd3-41bd-b861-d12dcb701e45.jpg?aki_policy=x_large,75741819,https://www.airbnb.com/users/show/75741819,Maria,2016-06-04,"London, England, United Kingdom","",N/A,N/A,N/A,f,https://a0.muscache.com/im/pictures/c8c6f611-f391-4f64-a3f6-578370984ef3.jpg?aki_policy=profile_small,https://a0.muscache.com/im/pictures/c8c6f611-f391-4f64-a3f6-578370984ef3.jpg?aki_policy=profile_x_medium,RB of Kingston upon Thames,1,1,"['email', 'phone', 'reviews']",t,f,"Kingston Hill, Kingston upon Thames, KT2 7PW, United Kingdom",RB of Kingston upon Thames,Kingston upon Thames,,Kingston upon Thames,,KT2 7PW,,"Kingston upon Thames, United Kingdom",GB,United Kingdom,51.415851007157926,-0.2864962796874816,t,Apartment,Private room,2,1.0,1,1,Real Bed,"{""Wireless Internet"",Kitchen,Heating,Washer,""Smoke detector"",""Carbon monoxide detector"",Essentials,Hangers,""Laptop friendly workspace"",""translation missing: en.hosting_amenity_49"",""translation missing: en.hosting_amenity_50""}",,$24.00,,,$400.00,,1,$0.00,1,1125,8 months ago,,0,0,0,0,2017-03-05,2,2016-07-06,2016-07-27,80,10,8,10,10,10,8,f,,,f,flexible,f,f,1,0.25
13472704,https://www.airbnb.com/rooms/13472704,20170304065726,2017-03-05,Double Room in North Kingston (Richmond Park),"My place is good for couples, solo adventurers, and business travellers . We are conveniently placed for Richmond Park (5 minute walk away), Bushy Park /Hampton Court (can get a boat ride from Kingston Pier), Canbury Park Gardens /river, Kew Gardens, Kingston shops (have a brilliant selection of high street shops including John Lewis). We are a 30 minute train ride into Waterloo.",We live in a clean but relaxed & friendly environment with lots of fresh flowers!,"My place is good for couples, solo adventurers, and business travellers . We are conveniently placed for Richmond Park (5 minute walk away), Bushy Park /Hampton Court (can get a boat ride from Kingston Pier), Canbury Park Gardens /river, Kew Gardens, Kingston shops (have a brilliant selection of high street shops including John Lewis). We are a 30 minute train ride into Waterloo. We live in a clean but relaxed & friendly environment with lots of fresh flowers! The kitchen, living room, downstairs loo, garden, bedroom, family bathroom. It's a very friendly, family orientated neighbourhood. We are less 10 minute walk to Kingston station & Norbiton. Lots of buses nearby including the 65 to Richmond / Ham. Can also get the boat to Hampton Court. We can offer parking parking permits at minimum cost should you need them.",none,"It's a very friendly, family orientated neighbourhood.",We can offer parking parking permits at minimum cost should you need them.,We are less 10 minute walk to Kingston station & Norbiton. Lots of buses nearby including the 65 to Richmond / Ham. Can also get the boat to Hampton Court.,"The kitchen, living room, downstairs loo, garden, bedroom, family bathroom.","","",https://a0.muscache.com/im/pictures/3c6bdcc7-06aa-4767-9a9f-21c7a24d9147.jpg?aki_policy=small,https://a0.muscache.com/im/pictures/3c6bdcc7-06aa-4767-9a9f-21c7a24d9147.jpg?aki_policy=medium,https://a0.muscache.com/im/pictures/3c6bdcc7-06aa-4767-9a9f-21c7a24d9147.jpg?aki_policy=large,https://a0.muscache.com/im/pictures/3c6bdcc7-06aa-4767-9a9f-21c7a24d9147.jpg?aki_policy=x_large,77078182,https://www.airbnb.com/users/show/77078182,Hannah,2016-06-11,"Kingston upon Thames, England, United Kingdom","Luke, my husband and I have two young girls (2.5yrs and 7 months) and love the outdoors, keeping fit, good food and meeting new people. We are well travelled (Luke loves surfing and generally anything involving the sea). We are a sociable pair but with young children there are some limits! I am currently on maternity leave so am around in the day with my children but we do also go out a lot. We are happy for you to help yourself to cereal and / or toast. We look forward to meeting you!",N/A,N/A,N/A,f,https://a0.muscache.com/im/pictures/20bf1fed-f3e7-4cb8-8ec9-eca9ed5f5bbf.jpg?aki_policy=profile_small,https://a0.muscache.com/im/pictures/20bf1fed-f3e7-4cb8-8ec9-eca9ed5f5bbf.jpg?aki_policy=profile_x_medium,RB of Kingston upon Thames,1,1,"['email', 'phone']",t,f,"Canbury Avenue, Kingston upon Thames, KT2 6JR, United Kingdom",RB of Kingston upon Thames,Kingston upon Thames,,Kingston upon Thames,,KT2 6JR,,"Kingston upon Thames, United Kingdom",GB,United Kingdom,51.415723440879056,-0.29224594091591005,t,House,Private room,2,1.5,1,1,Real Bed,"{TV,""Cable TV"",""Wireless Internet"",Kitchen,""Indoor fireplace"",Heating,Washer,Dryer,""Smoke detector"",""Carbon monoxide detector"",""First aid kit"",Essentials,""24-hour check-in"",Hangers,""Hair dryer"",Iron,""Laptop friendly workspace""}",,$50.00,,,$70.00,,1,$0.00,2,1125,9 months ago,,0,0,0,0,2017-03-05,0,,,,,,,,,,f,,,f,flexible,f,f,1,
17430865,https://www.airbnb.com/rooms/17430865,20170304065726,2017-03-05,family-friendly house,very new decorated beautiful room and very comfortable memory form of double bed,"",very new decorated beautiful room and very comfortable memory form of double bed,none,"","","","","",- no shoes in the house,https://a0.muscache.com/im/pictures/e49c47aa-de9e-4ff5-8d5e-c5c3b5ae43a5.jpg?aki_policy=small,https://a0.muscache.com/im/pictures/e49c47aa-de9e-4ff5-8d5e-c5c3b5ae43a5.jpg?aki_policy=medium,https://a0.muscache.com/im/pictures/e49c47aa-de9e-4ff5-8d5e-c5c3b5ae43a5.jpg?aki_policy=large,https://a0.muscache.com/im/pictures/e49c47aa-de9e-4ff5-8d5e-c5c3b5ae43a5.jpg?aki_policy=x_large,113972982,https://www.airbnb.com/users/show/113972982,Jung Kyung,2017-01-30,"London, England, United Kingdom","Hi ! My name is Jung Kyung Seo
Im 44 and I love travelling, my favourite place has got to be Italy, the food is incredible and the climbing the volcano-mountains to be greeted with an astonishing view is just breathtaking.
I love peaceful reading, looking after my rabbits and occasionally playing the piano
I happen to have a spare bedroom as my daughter has gone off to study at Uni.",within a day,100%,N/A,f,https://a0.muscache.com/im/pictures/e095059d-f2bb-418f-8f18-1676850817c0.jpg?aki_policy=profile_small,https://a0.muscache.com/im/pictures/e095059d-f2bb-418f-8f18-1676850817c0.jpg?aki_policy=profile_x_medium,RB of Kingston upon Thames,1,1,"['email', 'phone', 'google', 'jumio', 'offline_government_id', 'government_id']",t,t,"Kingston Road, New Malden, England KT3 3RX, United Kingdom",RB of Kingston upon Thames,Kingston upon Thames,,New Malden,England,KT3 3RX,London,"New Malden, United Kingdom",GB,United Kingdom,51.40428468735542,-0.27542591662401333,t,House,Private room,1,1.0,1,1,Real Bed,"{""Wireless Internet"",Kitchen,Breakfast,Heating,""Family/kid friendly"",Washer,Essentials,Shampoo}",,$25.00,,,,,1,$0.00,1,14,5 days ago,,29,59,89,179,2017-03-05,0,,,,,,,,,,f,,,f,flexible,f,f,1,
16374418,https://www.airbnb.com/rooms/16374418,20170304065726,2017-03-05,Cosy Tudor House near Kingston,"My place is close to Norbiton and Kingston stations, Tesco, restaurants, Richmond Park, 30mins train links to Waterloo. You’ll love my place because of the neighbourhood, the comfy bed, the light, the cosiness, and the kitchen. My place is good for couples, solo adventurers, business travellers, and families (with kids).",Ensuite top floor double bedroom with storage and skylights,"My place is close to Norbiton and Kingston stations, Tesco, restaurants, Richmond Park, 30mins train links to Waterloo. You’ll love my place because of the neighbourhood, the comfy bed, the light, the cosiness, and the kitchen. My place is good for couples, solo adventurers, business travellers, and families (with kids). Ensuite top floor double bedroom with storage and skylights Please give me a call on (PHONE NUMBER HIDDEN) to get keys I will be living in the property as well on other floors.  Happy to socialise and offer spare room for extra storage if needed. Quiet location with many trees, parks and shops and restaurants nearby.  Lovely neighbourhood. 7mins walk to Norbiton station, 10mins by bus to Kingston / New Malden There are 2 cats in the house.",none,"Quiet location with many trees, parks and shops and restaurants nearby.  Lovely neighbourhood.",There are 2 cats in the house.,"7mins walk to Norbiton station, 10mins by bus to Kingston / New Malden",Please give me a call on (PHONE NUMBER HIDDEN) to get keys,I will be living in the property as well on other floors.  Happy to socialise and offer spare room for extra storage if needed.,Need to feed and clean up from my cat.  It's very friendly to all age groups.,https://a0.muscache.com/im/pictures/d0495106-03ba-4e17-b38f-7f630fea06b8.jpg?aki_policy=small,https://a0.muscache.com/im/pictures/d0495106-03ba-4e17-b38f-7f630fea06b8.jpg?aki_policy=medium,https://a0.muscache.com/im/pictures/d0495106-03ba-4e17-b38f-7f630fea06b8.jpg?aki_policy=large,https://a0.muscache.com/im/pictures/d0495106-03ba-4e17-b38f-7f630fea06b8.jpg?aki_policy=x_large,3430124,https://www.airbnb.com/users/show/3430124,Mew,2012-08-31,"London, England, United Kingdom","",within a day,100%,N/A,f,https://a0.muscache.com/im/pictures/33cfe105-1623-480d-ba83-8c542e2c5361.jpg?aki_policy=profile_small,https://a0.muscache.com/im/pictures/33cfe105-1623-480d-ba83-8c542e2c5361.jpg?aki_policy=profile_x_medium,,1,1,"['email', 'phone', 'facebook', 'reviews']",t,f,"Orme Road, Kingston upon Thames, England KT1 3SB, United Kingdom",,Kingston upon Thames,,Kingston upon Thames,England,KT1 3SB,London,"Kingston upon Thames, United Kingdom",GB,United Kingdom,51.410153740017975,-0.2785748779678558,f,House,Private room,2,2.0,1,2,Real Bed,"{TV,""Cable TV"",Internet,""Wireless Internet"",Kitchen,""Free parking on premises"",""Pets allowed"",Gym,""Pets live on this property"",Cat(s),Heating,""Suitable for events"",Washer,""Smoke detector"",""First aid kit"",Essentials,Shampoo,""24-hour check-in"",Hangers,""Hair dryer"",Iron,""Laptop friendly workspace"",""Private living room"",""Private entrance""}",,$56.00,,,$100.00,,1,$0.00,1,30,5 weeks ago,,0,0,0,0,2017-03-05,2,2017-02-04,2017-02-17,100,10,10,10,10,9,10,f,,,t,flexible,f,f,1,2
17488553,https://www.airbnb.com/rooms/17488553,20170304065726,2017-03-05,Spacious Double Room in Kingston,"My place is close to Kingston upon Thames. You’ll love my place because of the location, the neighbourhood and cleanliness. My place is good for couples, solo adventurers, and business travellers.","","My place is close to Kingston upon Thames. You’ll love my place because of the location, the neighbourhood and cleanliness. My place is good for couples, solo adventurers, and business travellers.",none,"","","","","","",https://a0.muscache.com/im/pictures/c69148b8-5e2a-4a54-96a5-3aae3d973d8b.jpg?aki_policy=small,https://a0.muscache.com/im/pictures/c69148b8-5e2a-4a54-96a5-3aae3d973d8b.jpg?aki_policy=medium,https://a0.muscache.com/im/pictures/c69148b8-5e2a-4a54-96a5-3aae3d973d8b.jpg?aki_policy=large,https://a0.muscache.com/im/pictures/c69148b8-5e2a-4a54-96a5-3aae3d973d8b.jpg?aki_policy=x_large,115691984,https://www.airbnb.com/users/show/115691984,Haley,2017-02-09,GB,"",within an hour,100%,N/A,f,https://a0.muscache.com/im/pictures/13c6f597-c8d6-48ff-880c-8d2a912399ca.jpg?aki_policy=profile_small,https://a0.muscache.com/im/pictures/13c6f597-c8d6-48ff-880c-8d2a912399ca.jpg?aki_policy=profile_x_medium,,2,2,"['email', 'phone']",t,f,"Cambridge Gardens, Kingston upon Thames, England KT1 3NN, United Kingdom",,Kingston upon Thames,,Kingston upon Thames,England,KT1 3NN,London,"Kingston upon Thames, United Kingdom",GB,United Kingdom,51.410223889369895,-0.2883280254744715,f,Apartment,Private room,2,1.0,1,1,Real Bed,"{""Wireless Internet"",Kitchen,Breakfast,""Smoke detector"",Essentials,""Lock on bedroom door"",Hangers,""translation missing: en.hosting_amenity_49""}",,$35.00,,,,,1,$0.00,2,1125,4 days ago,,30,60,90,90,2017-03-05,0,,,,,,,,,,f,,,t,flexible,f,f,2,
